sample_id,legacy_image_id,image_path,text,raw_order,parsed_teams,human_division__Atlantic Division,human_division__Central Division,human_division__Southeast Division,human_division__Northwest Division,human_division__Pacific Division,human_division__Southwest Division,human_polarity__positive,human_polarity__negative,human_polarity__neutral,human_type__humor,human_type__highlight,primary_team_or_context
1rpmzel,597,images_jpg/1rpmzel.jpg,"Deep dive on the ""Jalen's"" in the NBA",328,"Chicago Bulls, Detroit Pistons",0,1,0,0,0,0,0,0,1,1,0,Chicago Bulls; Detroit Pistons
1ru33ee,683,images_jpg/1ru33ee.jpg,Doc Rivers reacts to Kyle Kuzma's incredible pass,376,"LA Clippers, Los Angeles Lakers",0,0,0,0,1,0,1,0,0,0,1,LA Clippers; Los Angeles Lakers
1qz0jgk,317,images_jpg/1qz0jgk.jpg,"With his trade to Washington, AD has finally completed the Shaq rainbow 😳",183,"Los Angeles Lakers, Washington Wizards",0,0,1,0,1,0,0,0,1,1,0,Los Angeles Lakers; Washington Wizards
1q6ylt6,64,images_jpg/1q6ylt6.jpg,"Fun Fact did you know that a regular G league game with Yang Hansen included, had more viewership than: MLB Game 7, NFL Christmas, NBA Christmas, Stanley Cup. What would the numbers be if somehow Hansen and Blazers reach atleast conference finals.. If a regular G League game pulled almost 50m...",36,Portland Trail Blazers,0,0,0,1,0,0,0,0,1,1,0,Portland Trail Blazers
1s0rots,774,images_jpg/1s0rots.jpg,Why does the original Timberwof look so baked? lol,422,Minnesota Timberwolves,0,0,0,1,0,0,0,1,0,1,0,Minnesota Timberwolves
1s314j7,796,images_jpg/1s314j7.jpg,Lakers fans were frustrated with the officiating vs. the Pistons,435,"Detroit Pistons, Los Angeles Lakers",0,1,0,0,1,0,0,1,0,1,0,Detroit Pistons; Los Angeles Lakers
1sacr69,906,images_jpg/1sacr69.jpg,The Milwaukee Antetokounmpos,504,Milwaukee Bucks,0,1,0,0,0,0,0,0,1,1,0,Milwaukee Bucks
1s4usje,828,images_jpg/1s4usje.jpg,"Nikola ""Gru"" Jokic",454,Denver Nuggets,0,0,0,1,0,0,1,0,0,1,0,Denver Nuggets
1q5gest,54,images_jpg/1q5gest.jpg,"I apologize for my past statements.
[Original post](https://www.reddit.com/r/NBATalk/comments/1pjy82e/the_thunder_went_on_a_206_run_to_end_the_half_20/)",31,Oklahoma City Thunder,0,0,0,1,0,0,1,0,0,1,0,Oklahoma City Thunder
1qu3fhr,235,images_jpg/1qu3fhr.jpg,Lebron passed on his quirk to his son.,138,Los Angeles Lakers,0,0,0,0,1,0,0,0,1,0,0,Los Angeles Lakers
1rq10xh,604,images_jpg/1rq10xh.jpg,Holy Sh*t - Lebron is a real Goat,333,Cleveland Cavaliers,0,1,0,0,0,0,0,1,0,1,0,Cleveland Cavaliers
1rtb0tn,675,images_jpg/1rtb0tn.jpg,"Just trying to ride out the clock I guess
This was after a very long segment where John Wall listed colleges. Blake Griffin is now putting to use up the rest of the air time.",372,Washington Wizards,0,0,1,0,0,0,0,0,1,1,0,Washington Wizards
1qjz4le,167,images_jpg/1qjz4le.jpg,"Pure hypothetical hate if you want :)
Jaylen Brown and Luka on the same team would be an immediate 3 peat dynasty.

Offensively they would flow like butter and Jaylens defense is exactly what Luka needs next to him. Perfect duo. (They'd have better chemistry than Tatum/Brown too)

""Yo Rob send Reaves for Brown just heard the C's might fire their GM and hire Nico""",95,"Boston Celtics, Cleveland Cavaliers",1,1,0,0,0,0,1,0,0,0,0,Boston Celtics; Cleveland Cavaliers
1s0iwsd,769,images_jpg/1s0iwsd.jpg,"Kennard is a blessing for the Lakers. Stats don't lie.
Dangerous hungry white boy. Everything that Dalton should have been man 😭 feel sorry for Dalton fr tho.",420,Los Angeles Lakers,0,0,0,0,1,0,0,1,0,1,0,Los Angeles Lakers
1scpmg0,935,images_jpg/1scpmg0.jpg,Lakers fans are a different breed,526,Los Angeles Lakers,0,0,0,0,1,0,0,0,1,1,0,Los Angeles Lakers
1s4krem,823,images_jpg/1s4krem.jpg,LoL! Isiah Thomas still upset that MJ made sure he couldn’t be on the Dream Team in 1992,451,"Chicago Bulls, Detroit Pistons",0,1,0,0,0,0,0,1,0,1,0,Chicago Bulls; Detroit Pistons
1qn7fh7,191,images_jpg/1qn7fh7.jpg,actually Luka is really one of the best trash talkers in the game😆😆😆,110,Dallas Mavericks,0,0,0,0,0,1,1,0,0,1,0,Dallas Mavericks
1rm9jir,561,images_jpg/1rm9jir.jpg,He got the first pick in the NBA Draft but at what cost?,309,"Atlanta Hawks, Golden State Warriors",0,0,1,0,1,0,0,1,0,1,0,Atlanta Hawks; Golden State Warriors
1r3goni,357,images_jpg/1r3goni.jpg,"Imagine my surprise seeing this
I did not know about the Trade, and I thought Yeah this is a clear indication how NBA is outright supporting the Thunder.",206,Oklahoma City Thunder,0,0,0,1,0,0,0,0,1,0,0,Oklahoma City Thunder
1s7nbi8,865,images_jpg/1s7nbi8.jpg,Are The Magic Okay?,481,Orlando Magic,0,0,1,0,0,0,0,1,0,1,0,Orlando Magic
1saaayw,904,images_jpg/1saaayw.jpg,delayed revenge but spurs fans never forget,502,San Antonio Spurs,0,0,0,0,0,1,0,1,0,1,0,San Antonio Spurs
1s7jequ,863,images_jpg/1s7jequ.jpg,"Jimmy Butler character sheet. 4 teams, 3 suspensions, 1 ACL. The build is chaos!",479,"Atlanta Hawks, Boston Celtics, Charlotte Hornets, Chicago Bulls, Cleveland Cavaliers, Dallas Mavericks, Denver Nuggets, Miami Heat, Minnesota Timberwolves, New Orleans Pelicans, New York Knicks",1,1,1,1,0,1,0,1,0,1,0,Atlanta Hawks; Boston Celtics; Charlotte Hornets; Chicago Bulls; Cleveland Cavaliers; Dallas Mavericks; Denver Nuggets; Miami Heat; Minnesota Timberwolves; New Orleans Pelicans; New York Knicks
1s708az,853,images_jpg/1s708az.jpg,"Pre Champs vs Champs
Phil Jackson coaching the Pre champs​​, Pat Riley​​ coaching the champs. ​Young and athletic vs ​the savvy vets? ​​​​​Which version of these squads win?

Edit: No Nets Kidd, Heat Lebron or Laker Shaq for obvious reasons​​",472,Los Angeles Lakers,0,0,0,0,1,0,0,0,1,1,0,Los Angeles Lakers
1qznajw,325,images_jpg/1qznajw.jpg,Curry moon shot but Ben Simmons,191,"Golden State Warriors, Philadelphia 76ers",1,0,0,0,1,0,0,0,1,1,0,Golden State Warriors; Philadelphia 76ers
1qenern,126,images_jpg/1qenern.jpg,Durant+Shai 😳,72,Oklahoma City Thunder,0,0,0,1,0,0,0,1,0,1,0,Oklahoma City Thunder
1sa57ev,899,images_jpg/1sa57ev.jpg,"SGA is the 4th referee, you can't touch him",500,Atlanta Hawks,0,0,1,0,0,0,0,1,0,1,0,Atlanta Hawks
1re33og,474,images_jpg/1re33og.jpg,"Who wins in a foot race?
Both of their games relay heavily on speed. I'm realizing I'm realizing I have no idea who's faster. Forget the GOAT convo for a second, but just straight speed??????????????????????????????????????????????????????????????????????????????????????????????????( adding characters to meet the requirement)",263,"Golden State Warriors, Miami Heat",0,0,1,0,1,0,0,0,1,1,0,Golden State Warriors; Miami Heat
1sa4bro,897,images_jpg/1sa4bro.jpg,He asked Ant if he ever took a number 2 during a game two years ago.,498,"Atlanta Hawks, Detroit Pistons",0,1,1,0,0,0,0,0,1,1,0,Atlanta Hawks; Detroit Pistons
1q0jrti,17,images_jpg/1q0jrti.jpg,The Luka experience as a Laker fan,6,Los Angeles Lakers,0,0,0,0,1,0,0,0,1,1,0,Los Angeles Lakers
1s2inio,791,images_jpg/1s2inio.jpg,Bruh Embiid,432,Philadelphia 76ers,1,0,0,0,0,0,0,1,0,1,0,Philadelphia 76ers
1qpxvo5,207,images_jpg/1qpxvo5.jpg,Hawks Win 4 Straight!!!! For Fearless Wins!!!! AH AH AH AH!!!!,122,Atlanta Hawks,0,0,1,0,0,0,1,0,0,1,1,Atlanta Hawks
1r8dlsq,428,images_jpg/1r8dlsq.jpg,KD isn't here for Twitter nonsense. He's innocent.,241,"Brooklyn Nets, Golden State Warriors, Oklahoma City Thunder",1,0,0,1,1,0,0,0,1,1,0,Brooklyn Nets; Golden State Warriors; Oklahoma City Thunder
1rr6nf0,646,images_jpg/1rr6nf0.jpg,"""I love basketball. What's wrong with shooting below average from the floor and getting 43 FT's? STOP HATING!""",357,Golden State Warriors,0,0,0,0,1,0,0,0,1,1,0,Golden State Warriors
1s0aa2d,764,images_jpg/1s0aa2d.jpg,Hawks in the win column. It was a golden win.,417,"Atlanta Hawks, Golden State Warriors",0,0,1,0,1,0,1,0,0,0,1,Atlanta Hawks; Golden State Warriors
1rrkh5o,652,images_jpg/1rrkh5o.jpg,Steve Kerr would bench Bam after he scored 31 in the 1st quarter,359,Golden State Warriors,0,0,0,0,1,0,0,1,0,1,0,Golden State Warriors
1r9xz6l,440,images_jpg/1r9xz6l.jpg,"""How bad are the Kings?"" 
 This bad...",249,Sacramento Kings,0,0,0,0,1,0,0,1,0,1,0,Sacramento Kings
1q9cdly,91,images_jpg/1q9cdly.jpg,BREAKING: Anthony Davis just released his first signature shoe 😳,51,New Orleans Pelicans,0,0,0,0,0,1,0,0,1,1,0,New Orleans Pelicans
1s6jtvt,848,images_jpg/1s6jtvt.jpg,Jalen Duren hit a tough shot over Zion Williamson then smacked Zion in the butt,468,New Orleans Pelicans,0,0,0,0,0,1,0,1,0,1,0,New Orleans Pelicans
1reyv4h,481,images_jpg/1reyv4h.jpg,"Ignore the starting lineups and final score, just know the Pistons beat the number one team in the West!",266,"Detroit Pistons, Golden State Warriors",0,1,0,0,1,0,0,1,0,1,0,Detroit Pistons; Golden State Warriors
1qdv7v8,115,images_jpg/1qdv7v8.jpg,Westbrook dagger off the glass,67,Oklahoma City Thunder,0,0,0,1,0,0,1,0,0,0,1,Oklahoma City Thunder
1pyyn1y,5,images_jpg/1pyyn1y.jpg,"We got Draymond Green at home... Draymond Green at home:
...",1,Golden State Warriors,0,0,0,0,1,0,0,1,0,1,0,Golden State Warriors
1rd48x4,468,images_jpg/1rd48x4.jpg,Put Pascal Siakam on the Celtics this year instead of Jaylen Brown and they'd still roughly be where they are right now if not better,260,Boston Celtics,1,0,0,0,0,0,0,1,0,0,0,Boston Celtics
1qqkdv3,214,images_jpg/1qqkdv3.jpg,Giannis for Kuminga salary matching is actually quite simple,127,"Golden State Warriors, Milwaukee Bucks",0,1,0,0,1,0,0,0,1,1,0,Golden State Warriors; Milwaukee Bucks
1qbz103,105,images_jpg/1qbz103.jpg,"Shams: ""Dallas Mavericks' Anthony Davis is likely to undergo surgery to repair ligament damage in his left hand and miss several months, sources tell ESPN. His Dallas season is essentially over, given the prognosis and the Mavs' direction.""
Day-to-dayvis done for the season. Nico Harrison better not get a job as a janitor with an NBA team bruh.",61,Dallas Mavericks,0,0,0,0,0,1,0,1,0,1,0,Dallas Mavericks
1sb8nra,922,images_jpg/1sb8nra.jpg,The NBA if it was only cities where players want to live,515,"Atlanta Hawks, Brooklyn Nets, Charlotte Hornets",1,0,1,0,0,0,0,0,1,1,0,Atlanta Hawks; Brooklyn Nets; Charlotte Hornets
1qody38,200,images_jpg/1qody38.jpg,"This isn’t even a meme, there’s a love hotel in Shinjuku called Bron Mode. Bring on the jokes plz.",117,Brooklyn Nets,1,0,0,0,0,0,0,0,1,1,0,Brooklyn Nets
1r4v4kg,376,images_jpg/1r4v4kg.jpg,"If ""is not over until I win"" was a person 😳",214,Atlanta Hawks,0,0,1,0,0,0,0,1,0,1,0,Atlanta Hawks
1q9kss9,93,images_jpg/1q9kss9.jpg,MJ Fans are loosing their minds at KD right now 😂,53,"Brooklyn Nets, Oklahoma City Thunder",1,0,0,1,0,0,0,0,1,1,0,Brooklyn Nets; Oklahoma City Thunder
1qlgrba,177,images_jpg/1qlgrba.jpg,Clippers bros???,102,LA Clippers,0,0,0,0,1,0,0,1,0,1,0,LA Clippers
1sb3bwx,920,images_jpg/1sb3bwx.jpg,Luka missing out on All-NBA for a 2nd straight year.,513,Dallas Mavericks,0,0,0,0,0,1,0,1,0,1,0,Dallas Mavericks
1sbzft5,927,images_jpg/1sbzft5.jpg,Hawks Stomping Thru Brooklyn Like What!!!! Four Straight!!!!,519,"Atlanta Hawks, Brooklyn Nets",1,0,1,0,0,0,1,0,0,1,0,Atlanta Hawks; Brooklyn Nets
1rwm1lp,715,images_jpg/1rwm1lp.jpg,Never forget that 17 years ago they let the Bulls wear Celtic jerseys against them,393,"Boston Celtics, Chicago Bulls",1,1,0,0,0,0,0,1,0,1,0,Boston Celtics; Chicago Bulls
1rnrlw1,578,images_jpg/1rnrlw1.jpg,Philadelphia and Atlanta tonight,317,"Atlanta Hawks, Philadelphia 76ers",1,0,1,0,0,0,0,0,1,1,0,Atlanta Hawks; Philadelphia 76ers
1s5bg7m,832,images_jpg/1s5bg7m.jpg,Adam Silver determining which teams to punish for tanking after the new rule changes:,456,"Atlanta Hawks, Boston Celtics, Brooklyn Nets, Charlotte Hornets, Chicago Bulls",1,1,1,0,0,0,0,1,0,1,0,Atlanta Hawks; Boston Celtics; Brooklyn Nets; Charlotte Hornets; Chicago Bulls
1rjnwj4,536,images_jpg/1rjnwj4.jpg,The King 👑,298,Los Angeles Lakers,0,0,0,0,1,0,1,0,0,0,1,Los Angeles Lakers
1qanldg,97,images_jpg/1qanldg.jpg,Three Hawks Wins Straight!!! Ah Ah Ah!!!,56,Atlanta Hawks,0,0,1,0,0,0,1,0,0,1,0,Atlanta Hawks
1rh6jcc,505,images_jpg/1rh6jcc.jpg,How I felt watching Jokic crash out last night as a Blazers fan.,283,"Denver Nuggets, Portland Trail Blazers",0,0,0,1,0,0,0,1,0,1,0,Denver Nuggets; Portland Trail Blazers
1sdb912,942,images_jpg/1sdb912.jpg,Figuring out how to survive the first round in the playoffs,529,"Atlanta Hawks, Boston Celtics, Brooklyn Nets, Charlotte Hornets, Chicago Bulls, Cleveland Cavaliers, Dallas Mavericks, Denver Nuggets, Detroit Pistons, Golden State Warriors, Houston Rockets, Indiana Pacers, LA Clippers, Los Angeles Lakers, Memphis Grizzlies, Miami Heat, Milwaukee Bucks, Minnesota Timberwolves",1,1,1,1,1,1,0,1,0,1,0,Atlanta Hawks; Boston Celtics; Brooklyn Nets; Charlotte Hornets; Chicago Bulls; Cleveland Cavaliers; Dallas Mavericks; Denver Nuggets; Detroit Pistons; Golden State Warriors; Houston Rockets; Indiana Pacers; LA Clippers; Los Angeles Lakers; Memphis Grizzlies; Miami Heat; Milwaukee Bucks; Minnesota Timberwolves
1r5s49c,386,images_jpg/1r5s49c.jpg,KD the funniest athlete lmaoooo,220,Oklahoma City Thunder,0,0,0,1,0,0,1,0,0,1,0,Oklahoma City Thunder
1r2r55j,350,images_jpg/1r2r55j.jpg,Russel,204,Oklahoma City Thunder,0,0,0,1,0,0,0,1,0,1,0,Oklahoma City Thunder
1q4yfue,43,images_jpg/1q4yfue.jpg,"Wrong answers only
Did anyone else know that Luka’s dad was in this tv show. “My two dad’s” from the late 1980’s early 90s.",24,Dallas Mavericks,0,0,0,0,0,1,0,0,1,1,0,Dallas Mavericks
1s3yi06,811,images_jpg/1s3yi06.jpg,Living off of one good season in Boston,442,Boston Celtics,1,0,0,0,0,0,0,1,0,1,0,Boston Celtics
1r7jv1w,417,images_jpg/1r7jv1w.jpg,CCTV footage from the Houston Rockets Training Center,234,Houston Rockets,0,0,0,0,0,1,0,1,0,1,0,Houston Rockets
1q7ty2r,75,images_jpg/1q7ty2r.jpg,"TBT: Who was the biggest snub on the NBA 75 greatest list?
Lot of solid names on this list from the NBA 75th anniversary team. Hard to overlook Vinsanity imho.",42,"Memphis Grizzlies, Toronto Raptors",1,0,0,0,0,1,0,0,1,0,1,Memphis Grizzlies; Toronto Raptors
1r60a12,396,images_jpg/1r60a12.jpg,Tari Eason in the locker room after KD files drop:,227,Oklahoma City Thunder,0,0,0,1,0,0,0,0,1,1,0,Oklahoma City Thunder
1sbikip,924,images_jpg/1sbikip.jpg,"Luka at OKC losing MVP race
https://youtu.be/Y9j3heYZAk8?si=ktHKX4K6j8X2EMls

Luka going down vs okc. Sorry MVP season. Shai it’s yours to lose to Wemby now",517,Oklahoma City Thunder,0,0,0,1,0,0,0,1,0,0,0,Oklahoma City Thunder
1qyxpcl,316,images_jpg/1qyxpcl.jpg,Spurs are back,182,San Antonio Spurs,0,0,0,0,0,1,0,0,1,0,0,San Antonio Spurs
1qkivni,169,images_jpg/1qkivni.jpg,"Luka out here ""Shaqtin' a Fool"". Turns down wide open 3 ball late in 4th quarter 😭",97,Dallas Mavericks,0,0,0,0,0,1,0,1,0,1,0,Dallas Mavericks
1s9860d,888,images_jpg/1s9860d.jpg,"But when you slightly touch Shai, it's a foul",492,Oklahoma City Thunder,0,0,0,1,0,0,0,1,0,1,0,Oklahoma City Thunder
1rt40uj,672,images_jpg/1rt40uj.jpg,Trae Young is the ultimate Good Luck Charm... for the other team,370,Atlanta Hawks,0,0,1,0,0,0,0,1,0,1,0,Atlanta Hawks
1q52pmp,44,images_jpg/1q52pmp.jpg,A truly historic run by Draymond Green 🙏🏽,25,Golden State Warriors,0,0,0,0,1,0,1,0,0,0,1,Golden State Warriors
1rmf7ms,562,images_jpg/1rmf7ms.jpg,Imagine if twitter were around and this pic was on the net every time Dr J had a bad game lmao,310,Philadelphia 76ers,1,0,0,0,0,0,0,1,0,1,0,Philadelphia 76ers
1qx6jhq,293,images_jpg/1qx6jhq.jpg,Simply the best,174,Golden State Warriors,0,0,0,0,1,0,0,0,1,1,0,Golden State Warriors
1s4gs79,820,images_jpg/1s4gs79.jpg,"Sir, Caitlin Clark just murdered Lebron James",448,Los Angeles Lakers,0,0,0,0,1,0,0,1,0,1,0,Los Angeles Lakers
1s61sb5,840,images_jpg/1s61sb5.jpg,LeBron's character sheet. Year 22. The process cannot be terminated.,462,Cleveland Cavaliers,0,1,0,0,0,0,0,1,0,1,0,Cleveland Cavaliers
1q57tt7,48,images_jpg/1q57tt7.jpg,Shai is really a 1 of 1 player. Imagine pulling out the flopping face at the free throw line SMH.,28,"Oklahoma City Thunder, Toronto Raptors",1,0,0,1,0,0,0,1,0,1,0,Oklahoma City Thunder; Toronto Raptors
1rvu6o1,705,images_jpg/1rvu6o1.jpg,Trust half The Process,388,Golden State Warriors,0,0,0,0,1,0,0,1,0,1,0,Golden State Warriors
1r567ql,380,images_jpg/1r567ql.jpg,"Congrats to the GOAT PG of all time (not counting Isiah Thomas, Nash, Luka, SGA, Magic, Oscar Robertson, Kyrie or Steph)",217,"Boston Celtics, Brooklyn Nets, Chicago Bulls",1,1,0,0,0,0,1,0,0,0,1,Boston Celtics; Brooklyn Nets; Chicago Bulls
1qnqyf4,196,images_jpg/1qnqyf4.jpg,"I got the perfect team in a random nba lineup generator🤣 This is only the best I’ve gotten so far.
I feel like it is the best so far With ANT and Joker but I feel like Hunter Tyson would be Ideal (Just Kidding!)",113,"Chicago Bulls, New Orleans Pelicans, San Antonio Spurs, Toronto Raptors",1,1,0,0,0,1,1,0,0,1,0,Chicago Bulls; New Orleans Pelicans; San Antonio Spurs; Toronto Raptors
1qugfwd,239,images_jpg/1qugfwd.jpg,Bol Bol doxxing his clothing plug on his fashion Insta,142,Denver Nuggets,0,0,0,1,0,0,0,1,0,1,0,Denver Nuggets
1rzhgv8,756,images_jpg/1rzhgv8.jpg,Jalen Green traveled all the way to his hometown Philippines,412,Houston Rockets,0,0,0,0,0,1,0,0,1,1,0,Houston Rockets
1rq5rki,605,images_jpg/1rq5rki.jpg,"Adam Silver announces Atlantas “Magic City Night” will be replaced with MMA night where Isiah Stewart will fight Musa Diabate
“We saw the card set to go down at the White House and just had to respond in kind with a spectacle of our own.”",334,Atlanta Hawks,0,0,1,0,0,0,0,1,0,1,0,Atlanta Hawks
1qe3h1t,117,images_jpg/1qe3h1t.jpg,"Thunderstruck 2.0?
Kevin, you can’t do that.",69,Oklahoma City Thunder,0,0,0,1,0,0,0,1,0,1,0,Oklahoma City Thunder
1rk0dbj,541,images_jpg/1rk0dbj.jpg,"Joe Mazzulla Reiterates Jayson Tatum Will Not Return Until He Passes The ‘Mazzulla Logic-Puzzle Meridian’
From The Onion:

  
BOSTON—Amid continued speculation about when the injured Celtics star might return to action, head coach Joe Mazzulla told reporters Tuesday that Jayson Tatum would remain sidelined until he successfully completed the “Mazzulla Logic-Puzzle Meridian,” a riddle- and reason-based gauntlet he devised to assess players’ mental readiness. “Look, I know it’s your guys’ job to ask, but my answer is the same as always: Jayson won’t be back on the floor until he scores at least an eight on the Mazzulla Logic Meridian, and he’s just not there yet,” a visibly annoyed Mazzulla told reporters, adding that while the forward had made encouraging progress on the Puzzle Corridor and successfully identified which of the seven bishop’s owls swallowed the golden mouse, he was still behind the ball at processing the Farmer’s Paradoxes at game speed. “He’s our future, okay? And we’re not going to put him out there if there’s any risk at all of him overheating mentally. So that’s why I need to be absolutely sure he can solve the Four-Level Riddle of the Mazzulla Arch-Conundrum. The worst thing we can do is set him back for next year with comprehension fatigue, right? He’s getting there. He’s putting in the work. But until he can distinguish the Staircase of Truth from the Staircase of Deception in under 40 seconds, there’s really nothing new to report.” At press time, Tatum had reportedly suffered a setback after he failed to clear the Serpent’s Cipher and accidentally moved on to the Riddler’s Crossing too soon, bumping his return timeline back another two to four weeks.",301,Boston Celtics,1,0,0,0,0,0,0,1,0,1,0,Boston Celtics
1qv30qo,247,images_jpg/1qv30qo.jpg,The Parade is over...,146,Boston Celtics,1,0,0,0,0,0,0,1,0,1,0,Boston Celtics
1rpxi2v,600,images_jpg/1rpxi2v.jpg,"I figured out how SGA does it
If you know how officiating works, you know there's a seniority. At every game, there's a senior level ref who the other refs will defer to. SGA knows where that ref is at all times and makes sure that he can't see whether or not there was contact. So on this play in the 1st, he knows the ref behind him is not a rookie ref and therefore is expected to make calls himself (not defer). He also knows to angle his body so the ref can't tell whether or not it's a flop. (it is)....",331,Golden State Warriors,0,0,0,0,1,0,0,0,1,0,0,Golden State Warriors
1qqdn4m,212,images_jpg/1qqdn4m.jpg,"Breaking News on The Freaky Greeky
Bucks trade former MVP and certified Freak to the Dodgers for prime Magic Johnson, also certified as a Freak.",126,Milwaukee Bucks,0,1,0,0,0,0,0,1,0,1,0,Milwaukee Bucks
1rm474k,558,images_jpg/1rm474k.jpg,Luka v. Jokic be like,307,"Dallas Mavericks, Denver Nuggets",0,0,0,1,0,1,0,0,1,1,0,Dallas Mavericks; Denver Nuggets
1r8fjnk,429,images_jpg/1r8fjnk.jpg,How did everyone come to view KD after the files,242,"Brooklyn Nets, Oklahoma City Thunder",1,0,0,1,0,0,0,0,1,0,0,Brooklyn Nets; Oklahoma City Thunder
1q72qq9,70,images_jpg/1q72qq9.jpg,Hair line 9 &amp; 3/4,38,Boston Celtics,1,0,0,0,0,0,0,0,1,1,0,Boston Celtics
1rtaocv,673,images_jpg/1rtaocv.jpg,Next stop for Kerr,371,Golden State Warriors,0,0,0,0,1,0,0,0,1,0,0,Golden State Warriors
1qvtw89,266,images_jpg/1qvtw89.jpg,"Bronny James Jr.
Bronny is by far the best 55th pick we've ever seen in the league. I genuinely believe he could turn into a solid bench or sixth man. He has shown glimpses of promise and I think if he improved as much as he did this year he will be a solid player. People are forgetting about PRE-CARDIAC ARREST Bronny. When he was at Sierra Canyon he was going crazy until his unfortunate medical issue. But he survived which is a 10% chance which means Bronny is 1/10 phenomenon. People also forget during the summer league Bronny was low key doing pretty good. He was one of the best people on the Summer League team aside from Dalton Knecht. He even locked up Cooper Flagg who recently just dropped 49 points and is looking to be the rookie of the year. If Bronny held him to 8 while the Hornets (On the longest win streak currently and have beat the Thunder 27) barely stopped him from getting 50. Just saying, Bronny might be the GOAT. No one else has the whole arena begging him to get put in from the start of the game to the end. Also did you know, Bronny has more points this season than Michael Jordan, Kobe, Jayson Tatum, Tyrese Haliburton, and Kyrie Irving combined. That is GOAT material.",158,Charlotte Hornets,0,0,1,0,0,0,1,0,0,0,0,Charlotte Hornets
1qvqx8p,265,images_jpg/1qvqx8p.jpg,President Obama nothing but net!,157,Brooklyn Nets,1,0,0,0,0,0,1,0,0,1,0,Brooklyn Nets
1qer8nt,128,images_jpg/1qer8nt.jpg,Did yall ever think that Spencer Jones looks like Yakub?,74,Atlanta Hawks,0,0,1,0,0,0,0,0,1,1,0,Atlanta Hawks
1rhcjj2,508,images_jpg/1rhcjj2.jpg,Chubby horse boy and the refs be like,285,LA Clippers,0,0,0,0,1,0,0,1,0,1,0,LA Clippers
1qv0zok,246,images_jpg/1qv0zok.jpg,The Onion with another W,145,Atlanta Hawks,0,0,1,0,0,0,0,1,0,1,0,Atlanta Hawks
1sa4dec,898,images_jpg/1sa4dec.jpg,The Magic Doesn’t Work on The Hawks!!! That’s three straight wins!!! Ah Ah Ah!!!,499,"Atlanta Hawks, Orlando Magic",0,0,1,0,0,0,1,0,0,0,1,Atlanta Hawks; Orlando Magic
1r0ozdw,332,images_jpg/1r0ozdw.jpg,Where the pistons and hornets are headed,193,"Charlotte Hornets, Detroit Pistons",0,1,1,0,0,0,0,0,1,1,0,Charlotte Hornets; Detroit Pistons
1rxxwmu,736,images_jpg/1rxxwmu.jpg,Dude is officially allergic to 30,402,Golden State Warriors,0,0,0,0,1,0,0,1,0,1,0,Golden State Warriors
1s8eqcg,876,images_jpg/1s8eqcg.jpg,SGA with 25 FTAs tonight,486,Golden State Warriors,0,0,0,0,1,0,0,0,1,1,0,Golden State Warriors
1q56et3,45,images_jpg/1q56et3.jpg,IS THIS YOUR KING?!?!,26,Golden State Warriors,0,0,0,0,1,0,0,1,0,1,0,Golden State Warriors
1qvzjfv,273,images_jpg/1qvzjfv.jpg,"Hornets realizing Ousmane Dieng might be on their roster:
Traded his ass before he was even on roster. Is negative ten minutes the shortest stint with a team in NBA history?",161,Charlotte Hornets,0,0,1,0,0,0,0,1,0,1,0,Charlotte Hornets
1r9wnj8,439,images_jpg/1r9wnj8.jpg,When the Knicks lose their 3 games against the Pistons by 84 combined points:,248,"Detroit Pistons, New York Knicks",1,1,0,0,0,0,0,1,0,1,0,Detroit Pistons; New York Knicks
1rj6cxv,531,images_jpg/1rj6cxv.jpg,Jordan 🚀🚀,297,Chicago Bulls,0,1,0,0,0,0,0,1,0,1,0,Chicago Bulls
1r0oa4p,331,images_jpg/1r0oa4p.jpg,When Isaiah Stewart sees a scuffle starting,192,Cleveland Cavaliers,0,1,0,0,0,0,0,0,1,1,0,Cleveland Cavaliers
1rtn68f,677,images_jpg/1rtn68f.jpg,Blake Griffin doing the Kawhi laugh,374,LA Clippers,0,0,0,0,1,0,0,0,1,1,0,LA Clippers
1qyrrot,314,images_jpg/1qyrrot.jpg,I think the pistons broke bro 😭,181,Detroit Pistons,0,1,0,0,0,0,0,1,0,1,0,Detroit Pistons
1sa25bl,896,images_jpg/1sa25bl.jpg,It’s rough out there for us bulls fans rn,497,Chicago Bulls,0,1,0,0,0,0,0,1,0,1,0,Chicago Bulls
1rjsng9,540,images_jpg/1rjsng9.jpg,"Sacramento ""Washed"" Kings",300,Sacramento Kings,0,0,0,0,1,0,0,1,0,1,0,Sacramento Kings
1rh3sth,504,images_jpg/1rh3sth.jpg,"Chuck: ""I don't mind touching guys up... I believe in touching guys up.""",282,"Atlanta Hawks, Boston Celtics, Brooklyn Nets, Charlotte Hornets, Chicago Bulls, Cleveland Cavaliers, Dallas Mavericks, Denver Nuggets, Detroit Pistons, Golden State Warriors, Houston Rockets, Indiana Pacers, LA Clippers, Los Angeles Lakers, Memphis Grizzlies, Miami Heat, Milwaukee Bucks, Minnesota Timberwolves",1,1,1,1,1,1,0,0,1,0,0,Atlanta Hawks; Boston Celtics; Brooklyn Nets; Charlotte Hornets; Chicago Bulls; Cleveland Cavaliers; Dallas Mavericks; Denver Nuggets; Detroit Pistons; Golden State Warriors; Houston Rockets; Indiana Pacers; LA Clippers; Los Angeles Lakers; Memphis Grizzlies; Miami Heat; Milwaukee Bucks; Minnesota Timberwolves
1qw2dph,277,images_jpg/1qw2dph.jpg,First Look at Anthony Davis as a Wizard.,164,Washington Wizards,0,0,1,0,0,0,0,0,1,1,0,Washington Wizards
1rsdj0p,663,images_jpg/1rsdj0p.jpg,Ayoooo what’s going on in Orlando?,365,Orlando Magic,0,0,1,0,0,0,0,1,0,1,0,Orlando Magic
