sample_id,legacy_image_id,image_path,text,raw_order,parsed_teams,human_division__Atlantic Division,human_division__Central Division,human_division__Southeast Division,human_division__Northwest Division,human_division__Pacific Division,human_division__Southwest Division,human_polarity__positive,human_polarity__negative,human_polarity__neutral,human_type__humor,human_type__highlight,primary_team_or_context
1qyiqyw,309,images_jpg/1qyiqyw.jpg,JR Smith’s mishap in Game 1 of 2018 NBA finals mentioned in Epstein files,178,"Cleveland Cavaliers, Golden State Warriors",0,1,0,0,1,0,0,1,0,1,0,Cleveland Cavaliers; Golden State Warriors
1qz173a,318,images_jpg/1qz173a.jpg,"Bro is feining
Harden fits the Cavs perfectly—this is just the start. Bounce-back Cavs turning it around Right now",184,Cleveland Cavaliers,0,1,0,0,0,0,1,0,0,0,1,Cleveland Cavaliers
1qfycir,139,images_jpg/1qfycir.jpg,Sexton tries to guard Steph to the tunnel,80,"Cleveland Cavaliers, Golden State Warriors",0,1,0,0,1,0,0,0,1,1,0,Cleveland Cavaliers; Golden State Warriors
1sacexg,905,images_jpg/1sacexg.jpg,"Forget the 100 point record, which player is mostly likely to get a quadruple double again? 👀",503,Oklahoma City Thunder,0,0,0,1,0,0,0,0,1,1,0,Oklahoma City Thunder
1qucu0i,238,images_jpg/1qucu0i.jpg,"One year ago today, where exactly were you when you first heard the news?
I was mostly napping the whole day, and then I decided to sit on the couch and turn on the TV and put on SportsCenter and the trade was revealed to me then. I remember mouthing ""Wow"". Insane trade.",141,"Atlanta Hawks, Golden State Warriors",0,0,1,0,1,0,1,0,0,0,1,Atlanta Hawks; Golden State Warriors
1sco52w,934,images_jpg/1sco52w.jpg,"I don’t think many people understand that Langston Galloway is mostly responsible for qualifying Team USA to them World Cups in the first place
LeBron who? This here is the real Captain America!

Man is always available to rep the flag in FIBA competition whenever the NBA guys are still in the middle of the season. 🫡",525,New York Knicks,1,0,0,0,0,0,1,0,0,1,0,New York Knicks
1qmmm20,187,images_jpg/1qmmm20.jpg,Guarding prime Harden be like,108,Houston Rockets,0,0,0,0,0,1,0,1,0,1,0,Houston Rockets
1r6f0bf,405,images_jpg/1r6f0bf.jpg,Rajon Rainbow,230,"Boston Celtics, Los Angeles Lakers",1,0,0,0,1,0,0,1,0,1,0,Boston Celtics; Los Angeles Lakers
1rbgwwu,453,images_jpg/1rbgwwu.jpg,I thought this was just a random Lakers fan casual but it's actually the House of Highlights social media manager. NBA discourse is cooked,253,Los Angeles Lakers,0,0,0,0,1,0,0,0,1,1,0,Los Angeles Lakers
1s7as98,857,images_jpg/1s7as98.jpg,Name a better jersey swap,475,Atlanta Hawks,0,0,1,0,0,0,0,1,0,1,0,Atlanta Hawks
1rzvspb,761,images_jpg/1rzvspb.jpg,Bruh Bronny,415,Los Angeles Lakers,0,0,0,0,1,0,0,1,0,1,0,Los Angeles Lakers
1qwcqbb,283,images_jpg/1qwcqbb.jpg,PeriodP,169,Portland Trail Blazers,0,0,0,1,0,0,0,0,1,1,0,Portland Trail Blazers
1rmk6i2,565,images_jpg/1rmk6i2.jpg,"The Spurs to the Pistons
design by qlurr on deviantart, I remade the drawing  
\-\_\_\_\_\_\_\_\_\_\_\_\_\_\_\_\_\_\_\_\_\_\_\_\_\_\_\_\_",311,"Detroit Pistons, San Antonio Spurs",0,1,0,0,0,1,0,1,0,1,0,Detroit Pistons; San Antonio Spurs
1rm4wkc,560,images_jpg/1rm4wkc.jpg,Trae Young Debut,308,Atlanta Hawks,0,0,1,0,0,0,0,0,1,1,0,Atlanta Hawks
1qgmbkj,143,images_jpg/1qgmbkj.jpg,"Today I remembered the greatest internet page, that exposes Jordon's menace and overrated nature",83,Chicago Bulls,0,1,0,0,0,0,0,1,0,1,0,Chicago Bulls
1qygkej,306,images_jpg/1qygkej.jpg,"No wonder the refs favor them 🥀🥀
OKC plays fast, shoots pretty, and celebrates like a boy band—pure zest, zero shame all season long!!!",177,Oklahoma City Thunder,0,0,0,1,0,0,1,0,0,0,0,Oklahoma City Thunder
1qw1g9o,275,images_jpg/1qw1g9o.jpg,PSA from the Dallas Mavericks to any potential free agents: “we hate you!”,163,Dallas Mavericks,0,0,0,0,0,1,0,1,0,1,0,Dallas Mavericks
1s2rc01,794,images_jpg/1s2rc01.jpg,The greatest basketball scene in the history of cinema,433,Indiana Pacers,0,1,0,0,0,0,1,0,0,0,1,Indiana Pacers
1r5m7ev,383,images_jpg/1r5m7ev.jpg,"Lakers and Ny Knicks in the future: Cooper Flagg, Luka Doncic, Aj Dybantsa, Giannis, Wemby, Other team Brunson, Mitchell, Bronny James, Sengun, Jokic",218,"Los Angeles Lakers, New York Knicks",1,0,0,0,1,0,0,0,1,0,0,Los Angeles Lakers; New York Knicks
1rhxih4,516,images_jpg/1rhxih4.jpg,Draymond mixtape,288,Golden State Warriors,0,0,0,0,1,0,0,1,0,1,0,Golden State Warriors
1s2t069,795,images_jpg/1s2t069.jpg,"Kyle ""Slo-mo"" Anderson's handle",434,"Atlanta Hawks, San Antonio Spurs",0,0,1,0,0,1,0,1,0,1,0,Atlanta Hawks; San Antonio Spurs
1qxsajj,297,images_jpg/1qxsajj.jpg,Dillon Brooks reveals his next move against LeBron James,175,"Los Angeles Lakers, Memphis Grizzlies",0,0,0,0,1,1,0,0,1,0,0,Los Angeles Lakers; Memphis Grizzlies
1qz98u8,322,images_jpg/1qz98u8.jpg,"Kings with the most ethical tank in the league. No benching star players, no tanking gimmicks, just pure ass hoops.",188,Sacramento Kings,0,0,0,0,1,0,1,0,0,0,0,Sacramento Kings
1rk9u9x,543,images_jpg/1rk9u9x.jpg,Tim Duncan would be proud,303,San Antonio Spurs,0,0,0,0,0,1,0,1,0,1,0,San Antonio Spurs
1rko9mb,546,images_jpg/1rko9mb.jpg,"""Keep my horse's name out of your mouth""",304,Atlanta Hawks,0,0,1,0,0,0,0,1,0,1,0,Atlanta Hawks
1qv7h4l,249,images_jpg/1qv7h4l.jpg,"Ima just call it now, Giannis is going to Miami.",148,"Miami Heat, Milwaukee Bucks",0,1,1,0,0,0,1,0,0,1,0,Miami Heat; Milwaukee Bucks
1rs2bvh,658,images_jpg/1rs2bvh.jpg,83 points is 83 points. It’s forever set in stone.,362,"Golden State Warriors, Houston Rockets",0,0,0,0,1,1,0,0,1,1,0,Golden State Warriors; Houston Rockets
1s24brs,788,images_jpg/1s24brs.jpg,Should Doc Rivers make the Hall of Fame?,430,LA Clippers,0,0,0,0,1,0,0,0,1,1,0,LA Clippers
1r14519,337,images_jpg/1r14519.jpg,When you try to investigate the Jazz for tanking,197,Utah Jazz,0,0,0,1,0,0,0,1,0,1,0,Utah Jazz
1rf0il0,482,images_jpg/1rf0il0.jpg,The Lakers should bench any size 18 shoe in clutch time,267,Los Angeles Lakers,0,0,0,0,1,0,0,0,1,1,0,Los Angeles Lakers
1s3fxo2,799,images_jpg/1s3fxo2.jpg,THANK YOU NICO!! YOU SAW THE VISION,437,Brooklyn Nets,1,0,0,0,0,0,1,0,0,0,0,Brooklyn Nets
1rubng9,688,images_jpg/1rubng9.jpg,"I'll be there when you're hurt, LeBoo",381,"Indiana Pacers, Miami Heat",0,1,1,0,0,0,0,0,1,0,0,Indiana Pacers; Miami Heat
1rp1ej9,589,images_jpg/1rp1ej9.jpg,Jayson Tatum's surgeon,322,Boston Celtics,1,0,0,0,0,0,0,1,0,1,0,Boston Celtics
1qs3umb,222,images_jpg/1qs3umb.jpg,"A recently retired Michael Jordan stops by the Bulls practice and Corey Benjamin says to him ""I'm sorry you retired, cause I wanted to take you 1 on 1"". Jordan (of course) took that personally and immediately challenged Benjamin to 1v1 (1999)",131,Chicago Bulls,0,1,0,0,0,0,0,0,1,1,0,Chicago Bulls
1s20rhb,786,images_jpg/1s20rhb.jpg,That’s Two Str8 More Than Great Wins!! Ah Ah!!,429,Atlanta Hawks,0,0,1,0,0,0,1,0,0,1,0,Atlanta Hawks
1s4by1a,816,images_jpg/1s4by1a.jpg,"The Sacramento Kings got beat so badly, their social media pages didn't want to post the final score bruh",445,Sacramento Kings,0,0,0,0,1,0,0,1,0,1,0,Sacramento Kings
1qiphik,161,images_jpg/1qiphik.jpg,Jamal Murray in the 2nd half against the Lakers 😭,93,"Denver Nuggets, Los Angeles Lakers",0,0,0,1,1,0,0,1,0,1,0,Denver Nuggets; Los Angeles Lakers
1s7mvir,864,images_jpg/1s7mvir.jpg,Greatest 1 hit wonder?,480,Atlanta Hawks,0,0,1,0,0,0,0,0,1,1,0,Atlanta Hawks
1s47k1i,814,images_jpg/1s47k1i.jpg,Three Straight The Hard Way. But…A Quality Road Win In Detroit!!! Ah Ah Ah!!!,444,Detroit Pistons,0,1,0,0,0,0,1,0,0,0,1,Detroit Pistons
1qv0hnb,244,images_jpg/1qv0hnb.jpg,“We fine in the west”,144,"Atlanta Hawks, Boston Celtics, Brooklyn Nets, Charlotte Hornets, Chicago Bulls, Cleveland Cavaliers, Dallas Mavericks, Denver Nuggets, Detroit Pistons, Golden State Warriors, Houston Rockets, Indiana Pacers, LA Clippers, Los Angeles Lakers, Memphis Grizzlies",1,1,1,1,1,1,0,0,1,0,0,Atlanta Hawks; Boston Celtics; Brooklyn Nets; Charlotte Hornets; Chicago Bulls; Cleveland Cavaliers; Dallas Mavericks; Denver Nuggets; Detroit Pistons; Golden State Warriors; Houston Rockets; Indiana Pacers; LA Clippers; Los Angeles Lakers; Memphis Grizzlies
1rgqn3b,498,images_jpg/1rgqn3b.jpg,"""I'm not no Clint Capela""",279,Atlanta Hawks,0,0,1,0,0,0,0,1,0,1,0,Atlanta Hawks
1qzk05v,324,images_jpg/1qzk05v.jpg,Josh Hart + Jose Alvarado: JoJo's Bizarre Adventures.,190,Philadelphia 76ers,1,0,0,0,0,0,0,0,1,1,0,Philadelphia 76ers
1qqawit,211,images_jpg/1qqawit.jpg,All star Jamal Murray,125,Denver Nuggets,0,0,0,1,0,0,1,0,0,1,0,Denver Nuggets
1q0mr39,18,images_jpg/1q0mr39.jpg,If LeBron just abandoned Bronny we could’ve had another 10 years of his prime,7,Los Angeles Lakers,0,0,0,0,1,0,0,1,0,1,0,Los Angeles Lakers
1s8hn84,877,images_jpg/1s8hn84.jpg,TIL: DeMarcus Cousins still plays pro basketball… in Mongolia 🇲🇳,487,Sacramento Kings,0,0,0,0,1,0,0,0,1,1,0,Sacramento Kings
1qhl18s,149,images_jpg/1qhl18s.jpg,Ty Lue drawing plays:,87,Cleveland Cavaliers,0,1,0,0,0,0,0,0,1,1,0,Cleveland Cavaliers
1r12225,335,images_jpg/1r12225.jpg,"Jimmy on IG: “hey bighead”, Buddy Hield: “Why you trade me😭”",195,New Orleans Pelicans,0,0,0,0,0,1,0,1,0,1,0,New Orleans Pelicans
1r26av7,347,images_jpg/1r26av7.jpg,"didn't know @wendys serves G.O.A.T ??
Employee: What would you like?

The TV Menu: LeBron Raymone James Sr.  

The man who saved Wendy's legacy.",203,"Cleveland Cavaliers, Los Angeles Lakers",0,1,0,0,1,0,1,0,0,1,0,Cleveland Cavaliers; Los Angeles Lakers
1qw2u01,278,images_jpg/1qw2u01.jpg,With his move to Washington AD has finally completed the Shaq rainbow,165,"Los Angeles Lakers, New Orleans Pelicans",0,0,0,0,1,1,1,0,0,1,0,Los Angeles Lakers; New Orleans Pelicans
1rmyk5p,572,images_jpg/1rmyk5p.jpg,Marcus Smart missed 2 open shots to secure the win for Denver,313,"Boston Celtics, Denver Nuggets",1,0,0,1,0,0,0,1,0,1,0,Boston Celtics; Denver Nuggets
1qi8u8b,158,images_jpg/1qi8u8b.jpg,Knicks have lost 9 of their last 11 games.,90,New York Knicks,1,0,0,0,0,0,0,1,0,1,0,New York Knicks
1r4v14e,375,images_jpg/1r4v14e.jpg,Very likely to happen that an American NBA MVP wont be seen in the 2020s decade.,213,"Golden State Warriors, Los Angeles Lakers",0,0,0,0,1,0,0,0,1,0,1,Golden State Warriors; Los Angeles Lakers
1r8nmcs,433,images_jpg/1r8nmcs.jpg,“Draymond Green is guarding you” if ykyk,245,Golden State Warriors,0,0,0,0,1,0,0,0,1,1,0,Golden State Warriors
1r7pll4,420,images_jpg/1r7pll4.jpg,Where does Triple Double Cocaine Bear rank all time?,235,Los Angeles Lakers,0,0,0,0,1,0,0,0,1,1,0,Los Angeles Lakers
1s6c22k,846,images_jpg/1s6c22k.jpg,"It’s not “goodbye”, it’s see you later @chicagobulls",466,Chicago Bulls,0,1,0,0,0,0,0,1,0,1,0,Chicago Bulls
1qtaxzk,226,images_jpg/1qtaxzk.jpg,One Year Ago Today: Steph &amp; Draymond’s Live Reaction to Luka-to-Lakers Trade News,134,"Golden State Warriors, Los Angeles Lakers",0,0,0,0,1,0,0,0,1,1,0,Golden State Warriors; Los Angeles Lakers
1rg6dy5,493,images_jpg/1rg6dy5.jpg,"Coming out (slowmosexual)
Hey yall, this post was hard for me make as my rents don’t know this and my longtime gf wants to start a life with me haha. But I’m finally admitting and coming out as a slowmosexual. I know, I know, in today’s political landscape we are very split, but I couldn’t take it no more as I can’t escape who I really am. I’ve always had a fascination with how slow Kyle Anderson played but so efficient at the same time. My love for his play style really questioned my sexuality, but I’m proud to say that I am out now!! 😎

Anybody else coming out??",274,LA Clippers,0,0,0,0,1,0,0,0,1,0,0,LA Clippers
1q6wsdd,63,images_jpg/1q6wsdd.jpg,"Class Presentation about Rudy Gobert🥹
I’ve got a presentation for my french class tomorrow (in french ofc) about the great glorious Rudy Gobert. Pls pray for me🙏🙏 because i can’t speak french for shit",35,Utah Jazz,0,0,0,1,0,0,0,0,1,1,0,Utah Jazz
1qmudvt,188,images_jpg/1qmudvt.jpg,Fan wearing KD jersey hears it from him,109,"Golden State Warriors, Oklahoma City Thunder",0,0,0,1,1,0,0,1,0,1,0,Golden State Warriors; Oklahoma City Thunder
1q0tm5z,20,images_jpg/1q0tm5z.jpg,"spurs fanbase is doomed
“top 10 all time player when healthy” pels fans and lakers fans will comfort you and agree, but your love for basketball will slowly die as he spends weeks of the season on the bench and you crawl into the playoffs only to get swept out of the 1st round as you say “damn if only he was healthy!”",8,San Antonio Spurs,0,0,0,0,0,1,0,1,0,1,0,San Antonio Spurs
1s8l8ym,879,images_jpg/1s8l8ym.jpg,"I'm Embarrased - Hawks Logo
I've been a fan since I was a kid who moved to Atlanta in 1992. Thirty-plus years!

I was on [NBA.com](http://NBA.com) just now looking at standings, and I noticed something that I never have before...I finally saw the Hawks logo the way it was meant to be seen.

My whole life I've been viewing it right to left. It always looked like some predatory Pac-Man-esque creature, like a hawk with a single tooth and open beak snapping at prey or something.

But today, for the first time ever, I viewed it left to right. And it's clearly just... a hawk. In flight probably. That's it. That's the whole thing.

I feel like an idiot. Thirty years. I can't be the only one. Right? Right??",488,Atlanta Hawks,0,0,1,0,0,0,0,0,1,1,0,Atlanta Hawks
1s1568y,777,images_jpg/1s1568y.jpg,Kuminga contributed to Warriors so Podz helped him,424,Golden State Warriors,0,0,0,0,1,0,0,1,0,1,0,Golden State Warriors
1s3eg0y,798,images_jpg/1s3eg0y.jpg,Lakers fans switch up fast,436,Los Angeles Lakers,0,0,0,0,1,0,0,1,0,1,0,Los Angeles Lakers
1rxs8du,732,images_jpg/1rxs8du.jpg,Impressive very nice. Now let's see Tim Duncan's gold medals.,399,San Antonio Spurs,0,0,0,0,0,1,1,0,0,0,1,San Antonio Spurs
1rp3t3c,590,images_jpg/1rp3t3c.jpg,You can't touch Shai,323,Oklahoma City Thunder,0,0,0,1,0,0,0,1,0,1,0,Oklahoma City Thunder
1rqhokn,622,images_jpg/1rqhokn.jpg,"Welcome to the GOAT Debate, Bam Adebayo!
The best part is I just watched the newest Jxmmy Highroller video about why it's impossible to score 100 points in today's NBA",343,Miami Heat,0,0,1,0,0,0,0,0,1,1,0,Miami Heat
1rw2cm6,707,images_jpg/1rw2cm6.jpg,Spencer Jones getting the Paul George special,390,"Indiana Pacers, LA Clippers, Oklahoma City Thunder",0,1,0,1,1,0,0,1,0,1,0,Indiana Pacers; LA Clippers; Oklahoma City Thunder
1q0ubxs,22,images_jpg/1q0ubxs.jpg,Good lord,10,Atlanta Hawks,0,0,1,0,0,0,0,0,1,1,0,Atlanta Hawks
1qvl1xo,262,images_jpg/1qvl1xo.jpg,"Just a wildly funny career for James Harden — always getting what he wants, and it never working out",156,"Houston Rockets, Oklahoma City Thunder",0,0,0,1,0,1,0,1,0,1,0,Houston Rockets; Oklahoma City Thunder
1re5dt0,476,images_jpg/1re5dt0.jpg,Luka with the game on the line,264,Dallas Mavericks,0,0,0,0,0,1,0,0,1,1,0,Dallas Mavericks
1q8dquv,77,images_jpg/1q8dquv.jpg,"Number 3 for Trae Young
So the Wizards ain't planning to retire number 3 for Bradley Beal someday?",44,"Atlanta Hawks, Washington Wizards",0,0,1,0,0,0,0,0,1,1,0,Atlanta Hawks; Washington Wizards
1qo5zqm,198,images_jpg/1qo5zqm.jpg,Luka Doncic last 4 games: 37.3 - 9.8 - 10.3 - 68 TS%,115,Dallas Mavericks,0,0,0,0,0,1,1,0,0,0,1,Dallas Mavericks
1ry7tgx,741,images_jpg/1ry7tgx.jpg,It only took 7 years for Deandre Ayton to realize he’s not a superstar,404,Phoenix Suns,0,0,0,0,1,0,0,1,0,1,0,Phoenix Suns
1r9jzqy,435,images_jpg/1r9jzqy.jpg,Why didn't the Knicks beat the Pistons? Are they stupid?,246,"Detroit Pistons, New York Knicks",1,1,0,0,0,0,0,1,0,1,0,Detroit Pistons; New York Knicks
1rokfyf,585,images_jpg/1rokfyf.jpg,The 2025-26 Pistons,320,Detroit Pistons,0,1,0,0,0,0,0,0,1,0,0,Detroit Pistons
1rqipag,627,images_jpg/1rqipag.jpg,"SGA seeing the Wizards let Bam attempt 43 FTs in a game
Not sure if OKC still has to play Washington but I bet there is a big red circle on SGA's calendar if they do.",346,"Oklahoma City Thunder, Sacramento Kings, Washington Wizards",0,0,1,1,1,0,0,1,0,1,0,Oklahoma City Thunder; Sacramento Kings; Washington Wizards
1qrle25,217,images_jpg/1qrle25.jpg,"""They’re so much more physical and quick than I could have ever imagined. You know that every NBA groupie is elite, but no matter how much you prepare, it’s challenging to be totally ready when you’re actually face to face with them outside the arena.""",128,"Brooklyn Nets, Cleveland Cavaliers, Golden State Warriors",1,1,0,0,1,0,0,1,0,1,0,Brooklyn Nets; Cleveland Cavaliers; Golden State Warriors
1r5s12c,385,images_jpg/1r5s12c.jpg,"Luka hates Dallas organization
After that Lakers-Mavs trade last year, Luka really hates the organization but Dallas fans will always have a special place in Luka’s heart. He hates Nico and Jason Kidd, btw.",219,"Dallas Mavericks, Los Angeles Lakers",0,0,0,0,1,1,0,1,0,0,0,Dallas Mavericks; Los Angeles Lakers
1qwf1xe,286,images_jpg/1qwf1xe.jpg,Welcome to D.C.,171,Washington Wizards,0,0,1,0,0,0,0,1,0,1,0,Washington Wizards
1qrmqwq,219,images_jpg/1qrmqwq.jpg,The Greek FREAK,130,Milwaukee Bucks,0,1,0,0,0,0,0,0,1,1,0,Milwaukee Bucks
1rbkxlt,454,images_jpg/1rbkxlt.jpg,Everytime I hear Mr. Dickerson I think of this happening,254,"Atlanta Hawks, Boston Celtics",1,0,1,0,0,0,0,1,0,1,0,Atlanta Hawks; Boston Celtics
1rq82rr,606,images_jpg/1rq82rr.jpg,Just a picture of Luka and the Lakers,335,Los Angeles Lakers,0,0,0,0,1,0,0,0,1,0,1,Los Angeles Lakers
1ru4bpn,685,images_jpg/1ru4bpn.jpg,Luka post game tonight,378,Dallas Mavericks,0,0,0,0,0,1,0,1,0,1,0,Dallas Mavericks
1q7m4p5,74,images_jpg/1q7m4p5.jpg,"Paolo's toe was behind the line. Haters gonna hate.
As close as it gets. If anything, too close to overturn.",41,Atlanta Hawks,0,0,1,0,0,0,0,1,0,1,0,Atlanta Hawks
1qz8mrt,320,images_jpg/1qz8mrt.jpg,10 Year Old Kobe Bryant in Italy,186,Los Angeles Lakers,0,0,0,0,1,0,0,0,1,0,1,Los Angeles Lakers
1qvvmsx,268,images_jpg/1qvvmsx.jpg,"Kuminga watching everybody else make trades right now..
Classic warriors not moving quickly with an asset they know is distressed.. I have a feeling Kuminga isn’t going to net them very much at this point.",159,Golden State Warriors,0,0,0,0,1,0,0,1,0,1,0,Golden State Warriors
1sb8j05,921,images_jpg/1sb8j05.jpg,"""Pack your bags Bronny, we're going back to Cleveland""",514,Cleveland Cavaliers,0,1,0,0,0,0,0,1,0,1,0,Cleveland Cavaliers
1scmj57,932,images_jpg/1scmj57.jpg,"Lakers’ fans relax, we good",523,Los Angeles Lakers,0,0,0,0,1,0,0,0,1,1,0,Los Angeles Lakers
1rqhod0,621,images_jpg/1rqhod0.jpg,Bam was just 11 points away from having the highest scoring game in the 2000s,342,Miami Heat,0,0,1,0,0,0,0,0,1,1,0,Miami Heat
1q8v3cy,85,images_jpg/1q8v3cy.jpg,The truly unbreakable record,47,Golden State Warriors,0,0,0,0,1,0,0,0,1,0,0,Golden State Warriors
1s78a5t,855,images_jpg/1s78a5t.jpg,What else must Luka do to win MVP?,474,Dallas Mavericks,0,0,0,0,0,1,0,1,0,1,0,Dallas Mavericks
1q75k3w,72,images_jpg/1q75k3w.jpg,"Tari Eason knows one word
When asked: ""What makes Deni so hard to defend?""

""Zebras""",40,Washington Wizards,0,0,1,0,0,0,0,1,0,1,0,Washington Wizards
1rugmjt,690,images_jpg/1rugmjt.jpg,I don’t blame him it’s literally lebron,382,Los Angeles Lakers,0,0,0,0,1,0,1,0,0,1,0,Los Angeles Lakers
1sb1vac,914,images_jpg/1sb1vac.jpg,Petition to replace the Lakers logo,510,Los Angeles Lakers,0,0,0,0,1,0,0,0,1,1,0,Los Angeles Lakers
1q58slq,52,images_jpg/1q58slq.jpg,SGA and the refs be like,30,Atlanta Hawks,0,0,1,0,0,0,0,1,0,1,0,Atlanta Hawks
1rvwjvp,706,images_jpg/1rvwjvp.jpg,A what sprain for Kawhi???,389,Toronto Raptors,1,0,0,0,0,0,0,1,0,1,0,Toronto Raptors
1rsb28u,661,images_jpg/1rsb28u.jpg,Eight Straight Hawks Wins !!!!!!!!,364,Atlanta Hawks,0,0,1,0,0,0,1,0,0,1,0,Atlanta Hawks
1q24rp6,26,images_jpg/1q24rp6.jpg,"I printed a life size Deandre Ayton poster and now it’s in my shower
I took the Deandre Ayton copypasta too far..    

i finally crossed the line and i need to confess because at this point i cannot keep pretending this is just irony.

Some of you know me on this sub as the guy who keeps posting Ayton copypastas. At first it was jokes. Then it became a bit. Then it became a routine. And somewhere along the way i stopped being ironic without really noticing.

It all started with a stupid bet with another redditor here. We were arguing for the thousandth time about Deandre Ayton being misunderstood, secretly elite, spiritually dominant, etc. He jokingly said if i was really that close to Ayton i should prove it. i replied that if Ayton wanted me to do something i would do it. Bet was made. Loser had to commit to the bit.

So i did what any sane married adult would do. i ordered a life size poster of Deandre Ayton in a Lakers jersey.

i didn’t go to some shady random site either.   
i used a website called BigPoster dot com, the kind of website offices use to print conference banners and trade show standees.   
They literally have an option called custom life size poster. You upload an image, choose exact human dimensions.. not sure if this is waterproof tho. 

i uploaded a high resolution Ayton photo, selected 7 feet scale because accuracy matters, paid an amount of money i will not repeat here, and waited.

When the package arrived my wife asked what it was. i told her it was a mirror. This was my first lie..and im not proud of this

i installed it in the bathroom. Specifically inside the shower area. Facing inward. At eye level. When i shower now, it feels like Ayton is there. Watching and supporting.   
Evaluating my defensive positioning...i swear the steam makes it more realistic.

Is this gay? Probably. Is it cheating. Maybe?!  

At some point it stopped being about the bet. i now schedule my showers. i think about rotations. i apologize out loud when i miss spots. i catch myself explaining my day to a laminated image of a man who does not know i exist.

The worst part is that it feels normal now. Like i unlocked a hidden Ayton perk. Shower chemistry. Locker room aura. Elite vertical spacing in a tiled environment.

So yes. The rumors are true. i followed through. The poster exists. The relationship is real. The marriage is probably not long for this world.. but i still love Vando!

i just wanted you all to know that words have consequences and sometimes a copypasta becomes a lifestyle.

If Ayton sees this. I kept my promise.  
And right now as i’m writing this, i’m sitting in front of my computer in my underwear, eating a bowl of cereal. i don’t really know if this is the moment where i should seriously question my life choices, or if i should just keep going and quietly admire Deandre Ayton’s beautiful hands, because they genuinely look so soft it almost feels disrespectful not to appreciate them.",13,Los Angeles Lakers,0,0,0,0,1,0,0,0,1,1,0,Los Angeles Lakers
1r9sh3y,438,images_jpg/1r9sh3y.jpg,"In the wake of the KD files, I found Shai, Luka and Deni's joint Reddit burner account",247,"Dallas Mavericks, Oklahoma City Thunder",0,0,0,1,0,1,0,0,1,1,0,Dallas Mavericks; Oklahoma City Thunder
1s0gww7,767,images_jpg/1s0gww7.jpg,How many games is this team losing?,418,"Atlanta Hawks, Boston Celtics, Brooklyn Nets, Charlotte Hornets, Chicago Bulls, Cleveland Cavaliers, Dallas Mavericks, Denver Nuggets, Detroit Pistons, Golden State Warriors, Houston Rockets, Indiana Pacers, LA Clippers",1,1,1,1,1,1,0,0,1,0,0,Atlanta Hawks; Boston Celtics; Brooklyn Nets; Charlotte Hornets; Chicago Bulls; Cleveland Cavaliers; Dallas Mavericks; Denver Nuggets; Detroit Pistons; Golden State Warriors; Houston Rockets; Indiana Pacers; LA Clippers
1rqka0p,630,images_jpg/1rqka0p.jpg,"Brandin Podziemski gave Jazz fans free chickens and a dub tonight.

Bro deserves a statue outside Delta Center for this 😭",349,Utah Jazz,0,0,0,1,0,0,1,0,0,0,0,Utah Jazz
1rqil94,626,images_jpg/1rqil94.jpg,"I think I might be the NBA fan equivalent of bad luck Brian. (Congrats Bam).
Super fan Travels to Miami hoping to see his hometown team play.  Sees historic game where bam drops 83 points on their Heads.",345,"Chicago Bulls, Miami Heat",0,1,1,0,0,0,1,0,0,1,0,Chicago Bulls; Miami Heat
1r6s351,410,images_jpg/1r6s351.jpg,AirPodz,231,Golden State Warriors,0,0,0,0,1,0,0,0,1,1,0,Golden State Warriors
1rrh68k,650,images_jpg/1rrh68k.jpg,Suddenly 47% field goal percentage is bad to lakers fans,358,Los Angeles Lakers,0,0,0,0,1,0,0,1,0,1,0,Los Angeles Lakers
1qvb9gs,254,images_jpg/1qvb9gs.jpg,The tale of Uncarus tells all never Unc too close to the sun,150,Phoenix Suns,0,0,0,0,1,0,0,0,1,1,0,Phoenix Suns
1rt2znc,671,images_jpg/1rt2znc.jpg,SGA and them damn shades man,369,Atlanta Hawks,0,0,1,0,0,0,0,1,0,1,0,Atlanta Hawks
1rf31ua,483,images_jpg/1rf31ua.jpg,Wemby is being watched by one of his kinds 👽🛸,268,Atlanta Hawks,0,0,1,0,0,0,0,0,1,1,0,Atlanta Hawks
1rgcjkb,494,images_jpg/1rgcjkb.jpg,Classic Perkins,275,"Atlanta Hawks, Boston Celtics",1,0,1,0,0,0,0,0,1,1,0,Atlanta Hawks; Boston Celtics
1s0pbsg,772,images_jpg/1s0pbsg.jpg,"If SGA wins another MVP and title, would he have a legitimate case over Dwyane Wade all-time?",421,Atlanta Hawks,0,0,1,0,0,0,0,0,1,0,0,Atlanta Hawks
1qv5dzp,248,images_jpg/1qv5dzp.jpg,"Warriors, Wolves, and Heat",147,"Golden State Warriors, Miami Heat, Minnesota Timberwolves",0,0,1,1,1,0,0,1,0,1,0,Golden State Warriors; Miami Heat; Minnesota Timberwolves
1sdcoud,943,images_jpg/1sdcoud.jpg,Luka Dončić and Austin Reaves are in the hospital,530,"Atlanta Hawks, Dallas Mavericks",0,0,1,0,0,1,0,1,0,1,0,Atlanta Hawks; Dallas Mavericks
1qbtnpd,103,images_jpg/1qbtnpd.jpg,Who will stop the giant meteor??,59,Golden State Warriors,0,0,0,0,1,0,1,0,0,1,0,Golden State Warriors
1s9dhu5,890,images_jpg/1s9dhu5.jpg,Anyone still thinks Jaylen Brown is better than Luka Doncic?,494,"Boston Celtics, Dallas Mavericks",1,0,0,0,0,1,0,0,1,1,0,Boston Celtics; Dallas Mavericks
1rqi9z3,625,images_jpg/1rqi9z3.jpg,Kelel ware making a whole lotta sense now,344,Atlanta Hawks,0,0,1,0,0,0,0,0,1,1,0,Atlanta Hawks
