sample_id,legacy_image_id,image_path,text,raw_order,parsed_teams,human_division__Atlantic Division,human_division__Central Division,human_division__Southeast Division,human_division__Northwest Division,human_division__Pacific Division,human_division__Southwest Division,human_polarity__positive,human_polarity__negative,human_polarity__neutral,human_type__humor,human_type__highlight,primary_team_or_context
1s6oe9u,849,images_jpg/1s6oe9u.jpg,Which duo would win the most rings?,469,"Chicago Bulls, Los Angeles Lakers",0,1,0,0,1,0,0,0,1,1,0,Chicago Bulls; Los Angeles Lakers
1ru3e0p,684,images_jpg/1ru3e0p.jpg,"""Fuck that thinner air in Denver. There’s about 15–20% less oxygen per breath there than at sea level. Shit's dangerous."" - Joel Embiid",377,Denver Nuggets,0,0,0,1,0,0,0,1,0,1,0,Denver Nuggets
1rgu5kk,500,images_jpg/1rgu5kk.jpg,When SGA don't get his free throws,280,"Phoenix Suns, Toronto Raptors",1,0,0,0,1,0,0,1,0,1,0,Phoenix Suns; Toronto Raptors
1qcj6oy,109,images_jpg/1qcj6oy.jpg,Should we start calling AD= Elijah Price?,64,New Orleans Pelicans,0,0,0,0,0,1,0,1,0,1,0,New Orleans Pelicans
1qpoh2p,205,images_jpg/1qpoh2p.jpg,Me just eating popcorn as Doc Rivers calls Joel Embiid the most talents player he's coached days before the divorce with Giannis is finalized. I wonder where he'll get traded too. Personally I'm thinking Miami.,120,"Miami Heat, Milwaukee Bucks, Philadelphia 76ers",1,1,1,0,0,0,0,1,0,1,0,Miami Heat; Milwaukee Bucks; Philadelphia 76ers
1qwhdr7,287,images_jpg/1qwhdr7.jpg,The curse of the snitch?,172,"Boston Celtics, Los Angeles Lakers",1,0,0,0,1,0,0,1,0,1,0,Boston Celtics; Los Angeles Lakers
1rsqw5h,668,images_jpg/1rsqw5h.jpg,Dejounte Murray with the most disrespectful crossover,367,Atlanta Hawks,0,0,1,0,0,0,0,1,0,1,0,Atlanta Hawks
1rvbv8m,700,images_jpg/1rvbv8m.jpg,You can't touch Shai but he can touch you,385,"Oklahoma City Thunder, Toronto Raptors",1,0,0,1,0,0,0,1,0,1,0,Oklahoma City Thunder; Toronto Raptors
1rr1gd2,645,images_jpg/1rr1gd2.jpg,"Hottest in the NBA!!!!!!! Seven Straight Hox Wins!
AH AH AH AH AH AH AH AH",356,Houston Rockets,0,0,0,0,0,1,1,0,0,1,1,Houston Rockets
1rpppbg,598,images_jpg/1rpppbg.jpg,Just Dort activities.,329,Detroit Pistons,0,1,0,0,0,0,0,1,0,1,0,Detroit Pistons
1qkfzp9,168,images_jpg/1qkfzp9.jpg,“Mike Dunleavy Jr. selling 29 other teams on Kuminga”,96,Golden State Warriors,0,0,0,0,1,0,0,0,1,1,0,Golden State Warriors
1rn7hjg,575,images_jpg/1rn7hjg.jpg,"Wembanyama after every win, Man is a Psychopath",315,San Antonio Spurs,0,0,0,0,0,1,0,1,0,1,0,San Antonio Spurs
1qnloaq,195,images_jpg/1qnloaq.jpg,Throwback to when Fred Vanvleet crossed up a kid at his camp and posted it on his IG,112,Toronto Raptors,1,0,0,0,0,0,1,0,0,1,0,Toronto Raptors
1s7uo0a,867,images_jpg/1s7uo0a.jpg,Prime glassman Day-to-Davis,482,New Orleans Pelicans,0,0,0,0,0,1,0,1,0,1,0,New Orleans Pelicans
1qlfbxp,175,images_jpg/1qlfbxp.jpg,Giannis and the Bucks,100,Milwaukee Bucks,0,1,0,0,0,0,0,1,0,1,0,Milwaukee Bucks
1qa1n0a,95,images_jpg/1qa1n0a.jpg,"4th down, season on the line and Caleb Williams hit the Jordan Jumpman logo in Chicago 🔥",54,Chicago Bulls,0,1,0,0,0,0,1,0,0,0,1,Chicago Bulls
1qmauw1,184,images_jpg/1qmauw1.jpg,Are these guy from Switzerland😂,107,"Brooklyn Nets, Charlotte Hornets",1,0,1,0,0,0,0,0,1,1,0,Brooklyn Nets; Charlotte Hornets
1r76gs1,413,images_jpg/1r76gs1.jpg,Peak Harden hate era had to been the funniest era in the NBA,233,"Cleveland Cavaliers, Houston Rockets",0,1,0,0,0,1,0,1,0,1,0,Cleveland Cavaliers; Houston Rockets
1rd7w6p,469,images_jpg/1rd7w6p.jpg,DeMarcus is full of love man 😎❤️‍🩹🔥,261,Sacramento Kings,0,0,0,0,1,0,1,0,0,0,0,Sacramento Kings
1sallit,911,images_jpg/1sallit.jpg,Victor Wembanyama be moving like Mr.Fantastic 😆😆,508,San Antonio Spurs,0,0,0,0,0,1,1,0,0,1,0,San Antonio Spurs
1r19ei1,338,images_jpg/1r19ei1.jpg,He got that Aardvark in him,198,Atlanta Hawks,0,0,1,0,0,0,1,0,0,1,0,Atlanta Hawks
1q208ii,25,images_jpg/1q208ii.jpg,This picture goes hard. Kawhi is on one lately,12,Toronto Raptors,1,0,0,0,0,0,1,0,0,0,1,Toronto Raptors
1qz8xu0,321,images_jpg/1qz8xu0.jpg,Loading that shit up like a punch 😅,187,"Boston Celtics, Chicago Bulls",1,1,0,0,0,0,0,1,0,1,0,Boston Celtics; Chicago Bulls
1r5w8ai,392,images_jpg/1r5w8ai.jpg,"The KD Files now have a helpful database.
Very helpful, will poke around later see if any interesting names pop up. Tried searching harden and a lot came up.",224,"Golden State Warriors, Oklahoma City Thunder",0,0,0,1,1,0,0,0,1,0,0,Golden State Warriors; Oklahoma City Thunder
1rvthkx,703,images_jpg/1rvthkx.jpg,TEN STRAIGHT HOX WINS!!! We run the south east!!! AH AH AH AH AH AH AH AH AH AH,386,"Atlanta Hawks, Charlotte Hornets",0,0,1,0,0,0,1,0,0,0,1,Atlanta Hawks; Charlotte Hornets
1qf4dyo,130,images_jpg/1qf4dyo.jpg,Deandre Hunter is Flop Embiid father,76,"Atlanta Hawks, Philadelphia 76ers",1,0,1,0,0,0,0,1,0,1,0,Atlanta Hawks; Philadelphia 76ers
1qkux81,171,images_jpg/1qkux81.jpg,Luka is actually an underrated defender,98,Dallas Mavericks,0,0,0,0,0,1,0,1,0,1,0,Dallas Mavericks
1s4tuh8,827,images_jpg/1s4tuh8.jpg,"M0NST⭐️R JALEN DUREN 2076!
Jalen Duren #0",453,Atlanta Hawks,0,0,1,0,0,0,1,0,0,1,0,Atlanta Hawks
1s5o9yt,836,images_jpg/1s5o9yt.jpg,Jordan wannabe,458,Chicago Bulls,0,1,0,0,0,0,0,1,0,1,0,Chicago Bulls
1rpgkkk,592,images_jpg/1rpgkkk.jpg,"We only allow ass beatings here, not ass smacking!",325,Atlanta Hawks,0,0,1,0,0,0,0,1,0,1,0,Atlanta Hawks
1rd37xn,467,images_jpg/1rd37xn.jpg,Go Tanks!,259,Houston Rockets,0,0,0,0,0,1,1,0,0,0,0,Houston Rockets
1qh84ne,146,images_jpg/1qh84ne.jpg,Watching Ant V Wemby,85,Atlanta Hawks,0,0,1,0,0,0,0,0,1,1,0,Atlanta Hawks
1r1m30c,342,images_jpg/1r1m30c.jpg,"Bro predicted 6 years ago 💀💀
I was scrolling through \*cough cough\* for nba 2k play throughs obviously, when I found this random comment prediction the AD trade 6 years ago. Nah this man is a visionary who's seen the future , somebody find him 💀💀",201,"Los Angeles Lakers, New Orleans Pelicans",0,0,0,0,1,1,0,0,1,1,0,Los Angeles Lakers; New Orleans Pelicans
1rpdzg7,591,images_jpg/1rpdzg7.jpg,Luke Kornet undefeated against strip clubs,324,Detroit Pistons,0,1,0,0,0,0,0,0,1,1,0,Detroit Pistons
1rh95gd,506,images_jpg/1rh95gd.jpg,"The Joker
🃏""Why so serious, Dort?🃏 I have the sneaking suspicion we’re not giving the people what they want.”🃏",284,Los Angeles Lakers,0,0,0,0,1,0,0,1,0,1,0,Los Angeles Lakers
1r4ym75,377,images_jpg/1r4ym75.jpg,Haters got KD fighting for his life,215,"Golden State Warriors, Oklahoma City Thunder",0,0,0,1,1,0,0,1,0,1,0,Golden State Warriors; Oklahoma City Thunder
1s2fq0a,790,images_jpg/1s2fq0a.jpg,Damn this look like a move that Chris Paul would do 😅,431,LA Clippers,0,0,0,0,1,0,0,1,0,1,0,LA Clippers
1r5vkzk,391,images_jpg/1r5vkzk.jpg,Jaylen brown with the step back three,223,Boston Celtics,1,0,0,0,0,0,1,0,0,1,0,Boston Celtics
1rorbpj,587,images_jpg/1rorbpj.jpg,The Pistons if Cade Cunningham doesn't exist,321,Detroit Pistons,0,1,0,0,0,0,0,0,1,1,0,Detroit Pistons
1q745uu,71,images_jpg/1q745uu.jpg,End of Another Hawk Era! Trae left it all on the court for the Hawks. Hawks Show Must Go On. Trae’s must too. AH AH AH!!!,39,Atlanta Hawks,0,0,1,0,0,0,1,0,0,0,1,Atlanta Hawks
1q0w0pe,23,images_jpg/1q0w0pe.jpg,Truly an unforgettable moment,11,"Boston Celtics, Golden State Warriors",1,0,0,0,1,0,1,0,0,1,0,Boston Celtics; Golden State Warriors
1s4c908,817,images_jpg/1s4c908.jpg,Derrick White vicious foul on SGA,446,San Antonio Spurs,0,0,0,0,0,1,0,1,0,1,0,San Antonio Spurs
1pyvrl5,3,images_jpg/1pyvrl5.jpg,"Video from 11 years ago titled ""Karl Towns POSTERS DEFENDER at 2014 Nike Hoop Summit.” Look who the defender turned out to be
Link - [https://youtu.be/g4bnBDBsM7g?si=gsOaiyBwNZb4u8ED](https://youtu.be/g4bnBDBsM7g?si=gsOaiyBwNZb4u8ED)",0,Minnesota Timberwolves,0,0,0,1,0,0,0,0,1,1,0,Minnesota Timberwolves
1rgk63h,495,images_jpg/1rgk63h.jpg,LeBron realizing why Portland paid DominAyton to go away:,276,"Los Angeles Lakers, Phoenix Suns, Portland Trail Blazers",0,0,0,1,1,0,0,1,0,1,0,Los Angeles Lakers; Phoenix Suns; Portland Trail Blazers
1q2mtiy,30,images_jpg/1q2mtiy.jpg,Two Thrilling Hawks Wins!! Ah Ah!!,17,Atlanta Hawks,0,0,1,0,0,0,1,0,0,1,0,Atlanta Hawks
1qvb7ad,252,images_jpg/1qvb7ad.jpg,A Harden-Mitchell backcourt,149,"Houston Rockets, Utah Jazz",0,0,0,1,0,1,0,0,1,1,0,Houston Rockets; Utah Jazz
1rqyyc0,641,images_jpg/1rqyyc0.jpg,Do you think Bam has discovered the true nature of being a NBA player after his 83 point explosion?,352,Miami Heat,0,0,1,0,0,0,0,0,1,1,0,Miami Heat
1qfspp8,136,images_jpg/1qfspp8.jpg,KD disgusted after Gobert’s air ball ft’s,77,"Oklahoma City Thunder, Utah Jazz",0,0,0,1,0,0,0,1,0,1,0,Oklahoma City Thunder; Utah Jazz
1q4eko4,38,images_jpg/1q4eko4.jpg,Anthony Edwards vicious foul on SGA,22,Atlanta Hawks,0,0,1,0,0,0,0,1,0,1,0,Atlanta Hawks
1q8w20q,87,images_jpg/1q8w20q.jpg,Rockets announcers said Deni Advija is a mix of LeBron and Harden 😭,49,Houston Rockets,0,0,0,0,0,1,0,1,0,1,0,Houston Rockets
1ru59d9,686,images_jpg/1ru59d9.jpg,"No sign of Jamal Jordan vs. the Lakers tonight.
Jamal finished with 5 points on 1-for-14 shooting and fouled out as the Nuggets fell to the Lakers in OT.",379,"Denver Nuggets, Los Angeles Lakers",0,0,0,1,1,0,0,1,0,0,0,Denver Nuggets; Los Angeles Lakers
1qcwx9n,111,images_jpg/1qcwx9n.jpg,“Defense wins championships”,65,Boston Celtics,1,0,0,0,0,0,0,0,1,1,0,Boston Celtics
1rqlbch,633,images_jpg/1rqlbch.jpg,"Best Conspiracy: Jaylen Brown Ejection
1) NBA didn't want Brown to distract from the Heat/Wizards Game

2) Nike wanted Jaylen out so he didn't upstage their athlete Wemby

3) NBA wanted a tight game. Advanced stats know JB is a net negative, ejection guaranteed a close game

4) Basketball gods cursed Brown with bad whistle over misspelling ""Naismith""

5) Drama: JB can't handle Tatum potentially taking the team back, emotions took over",350,"Miami Heat, Washington Wizards",0,0,1,0,0,0,0,1,0,1,0,Miami Heat; Washington Wizards
1ru7k0v,687,images_jpg/1ru7k0v.jpg,The Lakers finally got the W,380,Los Angeles Lakers,0,0,0,0,1,0,1,0,0,1,0,Los Angeles Lakers
1qve8sv,256,images_jpg/1qve8sv.jpg,Drew anime Shai what would be his named attacks?,152,Oklahoma City Thunder,0,0,0,1,0,0,0,0,1,0,0,Oklahoma City Thunder
1ryj5f5,746,images_jpg/1ryj5f5.jpg,Luka really had Karens flipping him off💀,406,Dallas Mavericks,0,0,0,0,0,1,0,1,0,1,0,Dallas Mavericks
1rpy72w,602,images_jpg/1rpy72w.jpg,"This is why people hate Thunder defense. Jaylin Williams knows he can't block this shot with Murray in the way. Instead of accepting that, he bulldozes Murray, hoping the foul gets called prior to the shot.",332,Oklahoma City Thunder,0,0,0,1,0,0,0,1,0,1,0,Oklahoma City Thunder
1rnsqp8,580,images_jpg/1rnsqp8.jpg,Jamal Murray when he sees the Lakers on the schedule,319,Los Angeles Lakers,0,0,0,0,1,0,0,1,0,1,0,Los Angeles Lakers
1s9b0ib,889,images_jpg/1s9b0ib.jpg,Go Blazers,493,Portland Trail Blazers,0,0,0,1,0,0,1,0,0,0,0,Portland Trail Blazers
1s7d1rw,859,images_jpg/1s7d1rw.jpg,You can be the next PAT BEV (2025)!!!,477,Los Angeles Lakers,0,0,0,0,1,0,0,0,1,1,0,Los Angeles Lakers
1rguqdu,502,images_jpg/1rguqdu.jpg,"Ernie Johnson: ""It is Alex Caruso, it is my son, and, there'll be a little something extra in your allowance this week; that was a heck of a game.""",281,Los Angeles Lakers,0,0,0,0,1,0,0,0,1,0,1,Los Angeles Lakers
1scrzzh,937,images_jpg/1scrzzh.jpg,LeBron and Bronny became the first father-son duo to cut the lead to 42,527,Los Angeles Lakers,0,0,0,0,1,0,1,0,0,1,0,Los Angeles Lakers
1rr1bxt,644,images_jpg/1rr1bxt.jpg,That’s Seven Straight Hawks Wins!!!Ah Ah Ah Ah Ah Ah Ah!!!!!!!,355,Atlanta Hawks,0,0,1,0,0,0,1,0,0,0,1,Atlanta Hawks
1r5u7ht,389,images_jpg/1r5u7ht.jpg,Live look at Kawhi after scoring 11 straight points for Team Stripes,222,Toronto Raptors,1,0,0,0,0,0,1,0,0,0,1,Toronto Raptors
1r1hayd,340,images_jpg/1r1hayd.jpg,Whole western conference ducking the spurs,200,San Antonio Spurs,0,0,0,0,0,1,0,0,1,1,0,San Antonio Spurs
1rpun6d,599,images_jpg/1rpun6d.jpg,Does Wiggins deserve to have his nickname snatched like Carmelo 🤔?,330,"Minnesota Timberwolves, Philadelphia 76ers",1,0,0,1,0,0,0,1,0,1,0,Minnesota Timberwolves; Philadelphia 76ers
1s887kc,871,images_jpg/1s887kc.jpg,DEEEEETROIT BASKETBALLLL,484,Detroit Pistons,0,1,0,0,0,0,0,1,0,1,0,Detroit Pistons
1qnj7s1,194,images_jpg/1qnj7s1.jpg,Lakers pre game celebration with Luka,111,Los Angeles Lakers,0,0,0,0,1,0,1,0,0,0,0,Los Angeles Lakers
1q2m7a0,29,images_jpg/1q2m7a0.jpg,What the Luka? 😅 Lakers assistant coach slaps Doncic on the arm and gravely injures him,16,Los Angeles Lakers,0,0,0,0,1,0,0,1,0,1,0,Los Angeles Lakers
1qapina,98,images_jpg/1qapina.jpg,Made out of glass,57,"Atlanta Hawks, Golden State Warriors",0,0,1,0,1,0,0,1,0,1,0,Atlanta Hawks; Golden State Warriors
1qw64zf,280,images_jpg/1qw64zf.jpg,POV: Rob Pelinka trying to make moves before the trade deadline approaches,167,Los Angeles Lakers,0,0,0,0,1,0,0,1,0,1,0,Los Angeles Lakers
1s4gkgd,819,images_jpg/1s4gkgd.jpg,Nikola Jokic's character sheet. Devs still refuse to nerf.,447,Denver Nuggets,0,0,0,1,0,0,0,1,0,1,0,Denver Nuggets
1rqzrr9,642,images_jpg/1rqzrr9.jpg,I just hope all of Bam’s victims will get justice.,353,Miami Heat,0,0,1,0,0,0,0,1,0,1,0,Miami Heat
1q2gg08,28,images_jpg/1q2gg08.jpg,"Denver Swiss National Team 🇨🇭
I am a big joker fan and I was hoping for something good this season but those 🇨🇭🇨🇭🇨🇭are hard to beat.",15,Denver Nuggets,0,0,0,1,0,0,0,1,0,1,0,Denver Nuggets
1rpimbv,594,images_jpg/1rpimbv.jpg,"KD is not gonna stay
Nearly crashed out right there lmfao. That groupchat is gonna be lit. You almost feel bad for his teammates.",326,"Golden State Warriors, Oklahoma City Thunder",0,0,0,1,1,0,0,1,0,1,0,Golden State Warriors; Oklahoma City Thunder
1qp3ewc,204,images_jpg/1qp3ewc.jpg,Clippers W.,119,LA Clippers,0,0,0,0,1,0,0,0,1,1,0,LA Clippers
1qyqfpc,312,images_jpg/1qyqfpc.jpg,Dallas made this statue to honor Anthony Davis,180,"Dallas Mavericks, New Orleans Pelicans",0,0,0,0,0,1,1,0,0,0,1,Dallas Mavericks; New Orleans Pelicans
1rfi14r,485,images_jpg/1rfi14r.jpg,Danny Ainge reaction to league investigation,269,Boston Celtics,1,0,0,0,0,0,0,1,0,1,0,Boston Celtics
1s8pe51,883,images_jpg/1s8pe51.jpg,Hawks Crept Up On The Leprechauns And BLADOW💥 2 Str8 Wins!!,491,"Atlanta Hawks, Boston Celtics",1,0,1,0,0,0,0,1,0,1,0,Atlanta Hawks; Boston Celtics
1qw4pg7,279,images_jpg/1qw4pg7.jpg,The Mavs front office after trading away the player they traded their franchise for last year,166,Dallas Mavericks,0,0,0,0,0,1,0,1,0,1,0,Dallas Mavericks
1qvhf6g,261,images_jpg/1qvhf6g.jpg,"BREAKING: The Los Angeles Clippers are trading James Harden to the Cleveland Cavaliers for Darius Garland and a second-round pick.
woops wrong James it seems.

!!!!!!!!!!!!!!!!!!!!!!!!!!!!!!!!!!!!!!!!!!!!!!!!!!!!!!!!!!!!!!!!!!!!!!!!!!!!!!!!!!!!!!!!!!!!!!!!!!!!!!!!!!!!!!!!!!!!!!!!!!!!!!!!!!!!!!!!!!!!!!!!!!!!!!!!!!!!!!!!!!!!!!!!!!!!!!!!!!!!!!!!!!!!!!!!!!!!!!!!!!!!!!!!!!!!!!!!!!!!!!!!!!!!!!!!!!!!!!!!!!!!!!!!!!!!!!!!!!!!!!!!!!!!!!!!!!!!!!!!!!!!!!!!!!!!!!!!!!!!!!!!!!!!!!!!!!!!!!!!!!!!!!!!!!!!!",155,"Cleveland Cavaliers, LA Clippers",0,1,0,0,1,0,0,1,0,1,0,Cleveland Cavaliers; LA Clippers
1q9jd8t,92,images_jpg/1q9jd8t.jpg,Anthony Davis when he sneezes too hard,52,New Orleans Pelicans,0,0,0,0,0,1,0,0,1,1,0,New Orleans Pelicans
1s64mhb,843,images_jpg/1s64mhb.jpg,Took the Mid from Akron and son 2 years just to get 1 assist,465,Cleveland Cavaliers,0,1,0,0,0,0,0,0,1,1,0,Cleveland Cavaliers
1rs5o8m,659,images_jpg/1rs5o8m.jpg,Kobe fans aren’t real 😭😭😭,363,Los Angeles Lakers,0,0,0,0,1,0,0,1,0,0,0,Los Angeles Lakers
1r13w95,336,images_jpg/1r13w95.jpg,KD and the never ending (but not ashy anymore) legs,196,"Golden State Warriors, Oklahoma City Thunder",0,0,0,1,1,0,0,0,1,1,0,Golden State Warriors; Oklahoma City Thunder
1rpk1a4,596,images_jpg/1rpk1a4.jpg,The NBA really makes no sense sometimes,327,"Brooklyn Nets, Houston Rockets",1,0,0,0,0,1,0,1,0,1,0,Brooklyn Nets; Houston Rockets
1qq0a31,209,images_jpg/1qq0a31.jpg,Rockets players trying to defend wemby,124,Houston Rockets,0,0,0,0,0,1,0,0,1,1,0,Houston Rockets
1ryhe5b,745,images_jpg/1ryhe5b.jpg,Ime wanted Bronny on the court,405,Los Angeles Lakers,0,0,0,0,1,0,0,0,1,1,0,Los Angeles Lakers
1qpwyhg,206,images_jpg/1qpwyhg.jpg,Bronny gets the steal &amp; the dunk to cut the lead down to 30,121,"Cleveland Cavaliers, Los Angeles Lakers",0,1,0,0,1,0,1,0,0,0,1,Cleveland Cavaliers; Los Angeles Lakers
1s9oyog,892,images_jpg/1s9oyog.jpg,Bruh AD,495,"Los Angeles Lakers, New Orleans Pelicans",0,0,0,0,1,1,0,1,0,1,0,Los Angeles Lakers; New Orleans Pelicans
1q35cfx,33,images_jpg/1q35cfx.jpg,Dwight Howard is in MrBeast’s next video,19,Orlando Magic,0,0,1,0,0,0,0,0,1,1,0,Orlando Magic
1rxojs0,730,images_jpg/1rxojs0.jpg,Imagine what the top 2 picks of this draft class could do,397,"Atlanta Hawks, Boston Celtics, Brooklyn Nets, Charlotte Hornets, Chicago Bulls, Cleveland Cavaliers, Dallas Mavericks, Denver Nuggets, Detroit Pistons",1,1,1,1,0,1,0,0,1,1,0,Atlanta Hawks; Boston Celtics; Brooklyn Nets; Charlotte Hornets; Chicago Bulls; Cleveland Cavaliers; Dallas Mavericks; Denver Nuggets; Detroit Pistons
1rrvpry,655,images_jpg/1rrvpry.jpg,A fight made Kawhi smile,361,Toronto Raptors,1,0,0,0,0,0,0,1,0,1,0,Toronto Raptors
1r7vw3o,422,images_jpg/1r7vw3o.jpg,Tf you mean KD got his own files now,236,"Brooklyn Nets, Oklahoma City Thunder",1,0,0,1,0,0,0,0,1,1,0,Brooklyn Nets; Oklahoma City Thunder
1s73m7v,854,images_jpg/1s73m7v.jpg,"Oh, the markets they'll overlook!
I really began to think about this as Houston took the WNBA back from Connecticut, and thinking about how KC and Rain City never got their flowers after Sacramento and Memphis took them away and let them wilt.",473,Houston Rockets,0,0,0,0,0,1,0,0,1,0,0,Houston Rockets
1r49j8f,368,images_jpg/1r49j8f.jpg,"Heat, Bulls and Hawks fans watching the Hornets try to ruin their annual play-in invitational",210,"Atlanta Hawks, Charlotte Hornets, Chicago Bulls, Miami Heat",0,1,1,0,0,0,0,1,0,1,0,Atlanta Hawks; Charlotte Hornets; Chicago Bulls; Miami Heat
1r22q6r,344,images_jpg/1r22q6r.jpg,Throwback when Kyrie had to do side missions just to play Basketball 😭,202,Cleveland Cavaliers,0,1,0,0,0,0,0,1,0,1,0,Cleveland Cavaliers
1s6jn0z,847,images_jpg/1s6jn0z.jpg,One Royal Atl Hawks Win! Bow Down Kings! Ah ah!!,467,"Atlanta Hawks, Sacramento Kings",0,0,1,0,1,0,1,0,0,1,0,Atlanta Hawks; Sacramento Kings
1ric9qs,522,images_jpg/1ric9qs.jpg,"Denver Windmill
It must be a foul because look at how wildly his arms are flailing! Give that potato-eater an Oscar!",291,Denver Nuggets,0,0,0,1,0,0,0,1,0,1,0,Denver Nuggets
1qszb8m,224,images_jpg/1qszb8m.jpg,One Year Ago Today: Luka Doncic - Anthony Davis trade randomly happens,132,"Dallas Mavericks, New Orleans Pelicans",0,0,0,0,0,1,0,1,0,1,0,Dallas Mavericks; New Orleans Pelicans
1r11nle,334,images_jpg/1r11nle.jpg,Am I crazy for thinking of Richard Jefferson 💀,194,"Atlanta Hawks, New York Knicks",1,0,1,0,0,0,0,1,0,1,0,Atlanta Hawks; New York Knicks
1qegxl6,123,images_jpg/1qegxl6.jpg,Curious Case of LeBronbenjamin Button,71,Los Angeles Lakers,0,0,0,0,1,0,0,0,1,1,0,Los Angeles Lakers
1q3znx9,35,images_jpg/1q3znx9.jpg,"here’s what happened after i posted my bathroom poster of Ayton and got myself in even more trouble
ok so, quick update on everything cuz this whole thing has gotten completely out of hand.

so here’s the deal: i ordered the Ayton poster and a matching mug from the same website. at first i was super happy, couldn’t wait to put it up on socials, a little tribute to my Lakers… nothing serious.

the first photo i posted was the Ayton poster in my bathroom, all alone. idea was simple:
show the poster, make the shower a bit less sad, and have a laugh with you guys..
except my wife saw the reddit post.
at first she thought it was just like a personal thing, no big deal. but when she saw i actually posted it online… yeah, that was the moment shit hit the fan. she started threatening divorce, calling me completely sicko, and i had to explain why i thought everyone should see my bathroom poster… yeah, very embarassing.

uhh… so yeah, just wanted to give a little update and quickly show the mug pic. the mug with Ayton and his girlfriend on it, filled with TWG tea, cuz at least i’m not completely insane and i deserve a tiny bit of luxury even if my life is a mess.

so yeah, between the poster in the bathroom, the mug with Ayton , and my wife threatening divorce… my life is just total mess. but hey, got my TWG tea, watching my team, and at least Ayton and his girlfriend are there keeping me company. loyal, obsessed, loser, but loyal.
Lets go Lakers, lets destroy the grizzlies.",21,"Los Angeles Lakers, Memphis Grizzlies",0,0,0,0,1,1,0,1,0,1,0,Los Angeles Lakers; Memphis Grizzlies
1sa7jd3,903,images_jpg/1sa7jd3.jpg,Hawks Sweep The Magic.,501,"Atlanta Hawks, Orlando Magic",0,0,1,0,0,0,1,0,0,1,0,Atlanta Hawks; Orlando Magic
1qajoca,96,images_jpg/1qajoca.jpg,[Highlight] Randle staring down Wemby and rubbing his hands together looking at his food,55,New York Knicks,1,0,0,0,0,0,0,0,1,1,0,New York Knicks
1rypi6e,750,images_jpg/1rypi6e.jpg,Barkley discussing the Lakers on this week’s Inside the NBA:,408,Los Angeles Lakers,0,0,0,0,1,0,0,1,0,1,0,Los Angeles Lakers
1rfxuxa,492,images_jpg/1rfxuxa.jpg,The Wiz clearly never studied the big fundamentals of basketball,273,Atlanta Hawks,0,0,1,0,0,0,0,1,0,1,0,Atlanta Hawks
1qewyfz,129,images_jpg/1qewyfz.jpg,"Naz Reid cooking KD.
Naz Reid cooking KD in 4k",75,Oklahoma City Thunder,0,0,0,1,0,0,0,1,0,1,0,Oklahoma City Thunder
1s17scy,778,images_jpg/1s17scy.jpg,"Obviously a lane violation, but only called when needed.",425,Boston Celtics,1,0,0,0,0,0,0,1,0,1,0,Boston Celtics
1sbhwd4,923,images_jpg/1sbhwd4.jpg,What the heck is Schröder doing?,516,"Atlanta Hawks, Oklahoma City Thunder",0,0,1,1,0,0,0,1,0,1,0,Atlanta Hawks; Oklahoma City Thunder
1rivugy,525,images_jpg/1rivugy.jpg,The Bucks are so done,293,Milwaukee Bucks,0,1,0,0,0,0,0,1,0,1,0,Milwaukee Bucks
1qfxttb,138,images_jpg/1qfxttb.jpg,Clippers in a nutshell,79,LA Clippers,0,0,0,0,1,0,0,0,1,1,0,LA Clippers
1s8ejxu,875,images_jpg/1s8ejxu.jpg,Ant didn't start in the game tonight because he was taking a shit lmao,485,"Atlanta Hawks, Charlotte Hornets, Cleveland Cavaliers",0,1,1,0,0,0,0,0,1,1,0,Atlanta Hawks; Charlotte Hornets; Cleveland Cavaliers
1rqisue,628,images_jpg/1rqisue.jpg,"Trae Young had to see 73 and 83 on his teams
Trae Young two years ago had Luka put 73 points on his team the same guy he got traded for: 

https://www.espn.com/nba/game/\_/gameId/401585262/mavericks-hawks

Fast forward today where Trae young is injured but Bam scored 83 on his team 

https://www.espn.com/nba/recap/\_/gameId/401810793

Might be cursed or something",347,"Atlanta Hawks, Dallas Mavericks",0,0,1,0,0,1,0,1,0,1,0,Atlanta Hawks; Dallas Mavericks
1rxovhz,731,images_jpg/1rxovhz.jpg,That’s Elem Wins Straight!!!!!!!!!!! AH AH AH AH AH AH AH AH AH AH AH,398,"Atlanta Hawks, Boston Celtics",1,0,1,0,0,0,1,0,0,1,0,Atlanta Hawks; Boston Celtics
1rix4hq,527,images_jpg/1rix4hq.jpg,Kings head coach Doug Christie gets LOCKED IN to take another L with some smelling salts,295,Sacramento Kings,0,0,0,0,1,0,0,1,0,1,0,Sacramento Kings
1r8hz73,430,images_jpg/1r8hz73.jpg,"When your name isn’t in the KD files
Seriously though, anyone else surprised by KD’s beef with Kerr and Curry, while dray got left out? I seem to recall the narrative surrounding KD’s departure was drama centered around dray, yet only Kerr and the “light-skin” (curry) were mentioned??",243,"Brooklyn Nets, Golden State Warriors",1,0,0,0,1,0,0,1,0,0,0,Brooklyn Nets; Golden State Warriors
1r5zo20,395,images_jpg/1r5zo20.jpg,"KD FILES
Legendary. NBA twitter is going insane. This day gonna go down in history as one of the funniest things to happen to the league 😭😭",226,"Brooklyn Nets, Oklahoma City Thunder",1,0,0,1,0,0,1,0,0,1,0,Brooklyn Nets; Oklahoma City Thunder
1qy98y6,303,images_jpg/1qy98y6.jpg,"At this point, All MVP Candidates might not meet 65 games requriement
Note: If they missed 18 games, they are out. 

Even SGA is injured right now. Though, he will probably missed 7 games before asb. But he will be reevaluated after.

The players above though are very probable to miss the game req. Yes, even Luka. He suffered a new injury right now.",176,"Dallas Mavericks, Golden State Warriors",0,0,0,0,1,1,0,1,0,1,0,Dallas Mavericks; Golden State Warriors
1ryk8aq,748,images_jpg/1ryk8aq.jpg,Is Bam going for SGA's record of consecutive 20+ points games?,407,Miami Heat,0,0,1,0,0,0,0,0,1,0,1,Miami Heat
1qm3ja8,182,images_jpg/1qm3ja8.jpg,CMON MIKAL 😩,105,Philadelphia 76ers,1,0,0,0,0,0,0,1,0,1,0,Philadelphia 76ers
1qucrzh,237,images_jpg/1qucrzh.jpg,"Don’t look now but the Charlotte Hornets have won 7 straight for the first time in nearly 10 years
You’re almost there boys, one more win and we can find somebody else to make fun of (maybe). One upvote is one prayer.",140,Charlotte Hornets,0,0,1,0,0,0,0,0,1,1,0,Charlotte Hornets
1s7uutj,868,images_jpg/1s7uutj.jpg,"""The most hyped prospect since LeBron""",483,Cleveland Cavaliers,0,1,0,0,0,0,0,1,0,1,0,Cleveland Cavaliers
1re7bw3,477,images_jpg/1re7bw3.jpg,Who wins an all-time dunk contest?,265,Chicago Bulls,0,1,0,0,0,0,0,0,1,1,0,Chicago Bulls
1rxug2x,734,images_jpg/1rxug2x.jpg,"Lebron - Not ""The"" Goat... but a Goat none the less",401,Cleveland Cavaliers,0,1,0,0,0,0,0,1,0,1,0,Cleveland Cavaliers
1rnfzsx,577,images_jpg/1rnfzsx.jpg,Kobe would be proud,316,Los Angeles Lakers,0,0,0,0,1,0,0,1,0,1,0,Los Angeles Lakers
1q7106k,68,images_jpg/1q7106k.jpg,"You're a Wizard, Trae
I'm a what?",37,Atlanta Hawks,0,0,1,0,0,0,0,0,1,1,0,Atlanta Hawks
1qfyu61,140,images_jpg/1qfyu61.jpg,Jamal Fucking Murray,81,Denver Nuggets,0,0,0,1,0,0,0,0,1,1,0,Denver Nuggets
